Sheet: Plan1
A1: FABRICANTE | B1: MODELO | C1: SERIE | D1: SINCARD | E1: OPERADORDA | F1: FONE | G1: CONTRATO
A2: WYLESSTELECOM | B2: 14 | C2: 48640173 | D2: NSA | E2: NSA | F2: NSA | G2: NSA | H2: =RANDBETWEEN(16161616,61616161) -> 28399582 | I2: =RC[-1]+873421 -> 29273003 | K2: 34682843
A3: WYLESSTELECOM | B3: 14 | C3: 63287356 | D3: NSA | E3: NSA | F3: NSA | G3: NSA | H3: =RANDBETWEEN(16161616,61616161) -> 47644149 | I3: =RC[-1]+873421 -> 48517570 | K3: 38019777
A4: WYLESSTELECOM | B4: 14 | C4: 77517675 | D4: NSA | E4: NSA | F4: NSA | G4: NSA | H4: =RANDBETWEEN(16161616,61616161) -> 25835098 | I4: =RC[-1]+873421 -> 26708519 | K4: 30139973
A5: WYLESSTELECOM | B5: 14 | C5: 74410267 | D5: NSA | E5: NSA | F5: NSA | G5: NSA | H5: =RANDBETWEEN(16161616,61616161) -> 27937586 | I5: =RC[-1]+873421 -> 28811007 | K5: 59335837
A6: WYLESSTELECOM | B6: 14 | C6: 28099683 | D6: NSA | E6: NSA | F6: NSA | G6: NSA | H6: =RANDBETWEEN(16161616,61616161) -> 20201397 | I6: =RC[-1]+873421 -> 21074818 | K6: 24893594
A7: WYLESSTELECOM | B7: 14 | C7: 40511295 | D7: NSA | E7: NSA | F7: NSA | G7: NSA | H7: =RANDBETWEEN(16161616,61616161) -> 41730757 | I7: =RC[-1]+873421 -> 42604178 | K7: 58755100
A8: WYLESSTELECOM | B8: 14 | C8: 51996542 | D8: NSA | E8: NSA | F8: NSA | G8: NSA | H8: =RANDBETWEEN(16161616,61616161) -> 28817564 | I8: =RC[-1]+873421 -> 29690985 | K8: 61484295
A9: WYLESSTELECOM | B9: 14 | C9: 62436353 | D9: NSA | E9: NSA | F9: NSA | G9: NSA | H9: =RANDBETWEEN(16161616,61616161) -> 59094584 | I9: =RC[-1]+873421 -> 59968005 | K9: 46643509
A10: WYLESSTELECOM | B10: 14 | C10: 63525566 | D10: NSA | E10: NSA | F10: NSA | G10: NSA | H10: =RANDBETWEEN(16161616,61616161) -> 41451471 | I10: =RC[-1]+873421 -> 42324892 | K10: 51405591
A11: WYLESSTELECOM | B11: 14 | C11: 72278133 | D11: NSA | E11: NSA | F11: NSA | G11: NSA | H11: =RANDBETWEEN(16161616,61616161) -> 52574687 | I11: =RC[-1]+873421 -> 53448108 | K11: 32394578
A12: WYLESSTELECOM | B12: 14 | C12: 21684102 | D12: NSA | E12: NSA | F12: NSA | G12: NSA | H12: =RANDBETWEEN(16161616,61616161) -> 28611302 | I12: =RC[-1]+873421 -> 29484723 | K12: 43589838
A13: WYLESSTELECOM | B13: 14 | C13: 38522692 | D13: NSA | E13: NSA | F13: NSA | G13: NSA | H13: =RANDBETWEEN(16161616,61616161) -> 47079174 | I13: =RC[-1]+873421 -> 47952595 | K13: 18686847
A14: WYLESSTELECOM | B14: 14 | C14: 31945110 | D14: NSA | E14: NSA | F14: NSA | G14: NSA | H14: =RANDBETWEEN(16161616,61616161) -> 49291837 | I14: =RC[-1]+873421 -> 50165258 | K14: 59773237
A15: WYLESSTELECOM | B15: 14 | C15: 37076134 | D15: NSA | E15: NSA | F15: NSA | G15: NSA | H15: =RANDBETWEEN(16161616,61616161) -> 35934476 | I15: =RC[-1]+873421 -> 36807897 | K15: 43403396
A16: WYLESSTELECOM | B16: 14 | C16: 22356753 | D16: NSA | E16: NSA | F16: NSA | G16: NSA | H16: =RANDBETWEEN(16161616,61616161) -> 30524984 | I16: =RC[-1]+873421 -> 31398405 | K16: 48953229
A17: WYLESSTELECOM | B17: 14 | C17: 51679328 | D17: NSA | E17: NSA | F17: NSA | G17: NSA | H17: =RANDBETWEEN(16161616,61616161) -> 57276028 | I17: =RC[-1]+873421 -> 58149449 | K17: 21658882
A18: WYLESSTELECOM | B18: 14 | C18: 30539854 | D18: NSA | E18: NSA | F18: NSA | G18: NSA | H18: =RANDBETWEEN(16161616,61616161) -> 34879503 | I18: =RC[-1]+873421 -> 35752924 | K18: 56989116
A19: WYLESSTELECOM | B19: 14 | C19: 58329593 | D19: NSA | E19: NSA | F19: NSA | G19: NSA | H19: =RANDBETWEEN(16161616,61616161) -> 51703167 | I19: =RC[-1]+873421 -> 52576588 | K19: 36960316
A20: WYLESSTELECOM | B20: 14 | C20: 42638019 | D20: NSA | E20: NSA | F20: NSA | G20: NSA | H20: =RANDBETWEEN(16161616,61616161) -> 44918478 | I20: =RC[-1]+873421 -> 45791899 | K20: 35016270