Sheet: Plan1
A1: FABRICANTE | B1: MODELO | C1: SERIE | D1: SINCARD | E1: OPERADORDA | F1: FONE | G1: CONTRATO
A2: CASASBAHIASA | B2: 14 | C2: 48640173 | D2: NSA | E2: NSA | F2: NSA | G2: NSA | H2: =RANDBETWEEN(16161616,61616161) -> 46156557 | I2: =RC[-1]+873421 -> 47029978 | K2: 34682841
A3: CASASBAHIASA | B3: 13 | C3: 63287356 | D3: NSA | E3: NSA | F3: NSA | G3: NSA | H3: =RANDBETWEEN(16161616,61616161) -> 18845805 | I3: =RC[-1]+873421 -> 19719226 | K3: 38019777
A4: CASASBAHIASA | B4: 14 | C4: 77517675 | D4: NSA | E4: NSA | F4: NSA | G4: NSA | H4: =RANDBETWEEN(16161616,61616161) -> 60034950 | I4: =RC[-1]+873421 -> 60908371 | K4: 30139973
A5: CASASBAHIASA | B5: 14 | C5: 74410267 | D5: NSA | E5: NSA | F5: NSA | G5: NSA | H5: =RANDBETWEEN(16161616,61616161) -> 25757929 | I5: =RC[-1]+873421 -> 26631350 | K5: 59335837
A6: CASASBAHIASA | B6: 14 | C6: 28099683 | D6: NSA | E6: NSA | F6: NSA | G6: NSA | H6: =RANDBETWEEN(16161616,61616161) -> 38407421 | I6: =RC[-1]+873421 -> 39280842 | K6: 24893594
A7: CASASBAHIASA | B7: 14 | C7: 40511295 | D7: NSA | E7: NSA | F7: NSA | G7: NSA | H7: =RANDBETWEEN(16161616,61616161) -> 19186739 | I7: =RC[-1]+873421 -> 20060160 | K7: 58755100
A8: CASASBAHIASA | B8: 14 | C8: 51996542 | D8: NSA | E8: NSA | F8: NSA | G8: NSA | H8: =RANDBETWEEN(16161616,61616161) -> 25503403 | I8: =RC[-1]+873421 -> 26376824 | K8: 61484295
A9: CASASBAHIASA | B9: 14 | C9: 62436353 | D9: NSA | E9: NSA | F9: NSA | G9: NSA | H9: =RANDBETWEEN(16161616,61616161) -> 18557764 | I9: =RC[-1]+873421 -> 19431185 | K9: 46643509
A10: CASASBAHIASA | B10: 14 | C10: 63525566 | D10: NSA | E10: NSA | F10: NSA | G10: NSA | H10: =RANDBETWEEN(16161616,61616161) -> 57938180 | I10: =RC[-1]+873421 -> 58811601 | K10: 51405591
A11: CASASBAHIASA | B11: 14 | C11: 72278133 | D11: NSA | E11: NSA | F11: NSA | G11: NSA | H11: =RANDBETWEEN(16161616,61616161) -> 46236954 | I11: =RC[-1]+873421 -> 47110375 | K11: 32394578
A12: CASASBAHIASA | B12: 14 | C12: 21684102 | D12: NSA | E12: NSA | F12: NSA | G12: NSA | H12: =RANDBETWEEN(16161616,61616161) -> 39844772 | I12: =RC[-1]+873421 -> 40718193 | K12: 43589838
A13: CASASBAHIASA | B13: 14 | C13: 38522692 | D13: NSA | E13: NSA | F13: NSA | G13: NSA | H13: =RANDBETWEEN(16161616,61616161) -> 35860108 | I13: =RC[-1]+873421 -> 36733529 | K13: 18686847
A14: CASASBAHIASA | B14: 14 | C14: 31945110 | D14: NSA | E14: NSA | F14: NSA | G14: NSA | H14: =RANDBETWEEN(16161616,61616161) -> 42184214 | I14: =RC[-1]+873421 -> 43057635 | K14: 59773237
A15: CASASBAHIASA | B15: 14 | C15: 37076134 | D15: NSA | E15: NSA | F15: NSA | G15: NSA | H15: =RANDBETWEEN(16161616,61616161) -> 32449216 | I15: =RC[-1]+873421 -> 33322637 | K15: 43403396
A16: CASASBAHIASA | B16: 14 | C16: 22356753 | D16: NSA | E16: NSA | F16: NSA | G16: NSA | H16: =RANDBETWEEN(16161616,61616161) -> 45603340 | I16: =RC[-1]+873421 -> 46476761 | K16: 48953229
A17: CASASBAHIASA | B17: 14 | C17: 51679328 | D17: NSA | E17: NSA | F17: NSA | G17: NSA | H17: =RANDBETWEEN(16161616,61616161) -> 54769028 | I17: =RC[-1]+873421 -> 55642449 | K17: 21658882
A18: CASASBAHIASA | B18: 14 | C18: 30539854 | D18: NSA | E18: NSA | F18: NSA | G18: NSA | H18: =RANDBETWEEN(16161616,61616161) -> 51188785 | I18: =RC[-1]+873421 -> 52062206 | K18: 56989116
A19: CASASBAHIASA | B19: 14 | C19: 58329593 | D19: NSA | E19: NSA | F19: NSA | G19: NSA | H19: =RANDBETWEEN(16161616,61616161) -> 16823529 | I19: =RC[-1]+873421 -> 17696950 | K19: 36960316
A20: CASASBAHIASA | B20: 14 | C20: 42638019 | D20: NSA | E20: NSA | F20: NSA | G20: NSA | H20: =RANDBETWEEN(16161616,61616161) -> 55273857 | I20: =RC[-1]+873421 -> 56147278 | K20: 35016270
A21: CASASBAHIASA | B21: 14 | C21: 58772591 | D21: NSA | E21: NSA | F21: NSA | G21: NSA | H21: =RANDBETWEEN(16161616,61616161) -> 18571827 | I21: =RC[-1]+873421 -> 19445248
A22: CASASBAHIASA | B22: 14 | C22: 19297844 | D22: NSA | E22: NSA | F22: NSA | G22: NSA | H22: =RANDBETWEEN(16161616,61616161) -> 24241602 | I22: =RC[-1]+873421 -> 25115023
A23: CASASBAHIASA | B23: 14 | C23: 32639664 | D23: NSA | E23: NSA | F23: NSA | G23: NSA | H23: =RANDBETWEEN(16161616,61616161) -> 21848134 | I23: =RC[-1]+873421 -> 22721555
A24: CASASBAHIASA | B24: 14 | C24: 71435557 | D24: NSA | E24: NSA | F24: NSA | G24: NSA | H24: =RANDBETWEEN(16161616,61616161) -> 24546471 | I24: =RC[-1]+873421 -> 25419892
A25: CASASBAHIASA | B25: 14 | C25: 54426026 | D25: NSA | E25: NSA | F25: NSA | G25: NSA | H25: =RANDBETWEEN(16161616,61616161) -> 26254647 | I25: =RC[-1]+873421 -> 27128068
A26: CASASBAHIASA | B26: 14 | C26: 53473336 | D26: NSA | E26: NSA | F26: NSA | G26: NSA | H26: =RANDBETWEEN(16161616,61616161) -> 54880120 | I26: =RC[-1]+873421 -> 55753541
A27: CASASBAHIASA | B27: 14 | C27: 47294160 | D27: NSA | E27: NSA | F27: NSA | G27: NSA | H27: =RANDBETWEEN(16161616,61616161) -> 56317566 | I27: =RC[-1]+873421 -> 57190987
A28: CASASBAHIASA | B28: 14 | C28: 71054876 | D28: NSA | E28: NSA | F28: NSA | G28: NSA | H28: =RANDBETWEEN(16161616,61616161) -> 53120908 | I28: =RC[-1]+873421 -> 53994329
A29: CASASBAHIASA | B29: 14 | C29: 52753461 | D29: NSA | E29: NSA | F29: NSA | G29: NSA | H29: =RANDBETWEEN(16161616,61616161) -> 50182451 | I29: =RC[-1]+873421 -> 51055872
A30: CASASBAHIASA | B30: 14 | C30: 74943448 | D30: NSA | E30: NSA | F30: NSA | G30: NSA | H30: =RANDBETWEEN(16161616,61616161) -> 60287324 | I30: =RC[-1]+873421 -> 61160745
A31: CASASBAHIASA | B31: 14 | C31: 45034482 | D31: NSA | E31: NSA | F31: NSA | G31: NSA | H31: =RANDBETWEEN(16161616,61616161) -> 44546459 | I31: =RC[-1]+873421 -> 45419880
A32: CASASBAHIASA | B32: 14 | C32: 48385627 | D32: NSA | E32: NSA | F32: NSA | G32: NSA | H32: =RANDBETWEEN(16161616,61616161) -> 27048797 | I32: =RC[-1]+873421 -> 27922218
A33: CASASBAHIASA | B33: 14 | C33: 22923842 | D33: NSA | E33: NSA | F33: NSA | G33: NSA | H33: =RANDBETWEEN(16161616,61616161) -> 35422446 | I33: =RC[-1]+873421 -> 36295867
A34: CASASBAHIASA | B34: 14 | C34: 72231420 | D34: NSA | E34: NSA | F34: NSA | G34: NSA | H34: =RANDBETWEEN(16161616,61616161) -> 41575022 | I34: =RC[-1]+873421 -> 42448443
A35: CASASBAHIASA | B35: 14 | C35: 63143839 | D35: NSA | E35: NSA | F35: NSA | G35: NSA | H35: =RANDBETWEEN(16161616,61616161) -> 17538167 | I35: =RC[-1]+873421 -> 18411588
A36: CASASBAHIASA | B36: 14 | C36: 22869304 | D36: NSA | E36: NSA | F36: NSA | G36: NSA | H36: =RANDBETWEEN(16161616,61616161) -> 23786222 | I36: =RC[-1]+873421 -> 24659643
A37: CASASBAHIASA | B37: 14 | C37: 29844120 | D37: NSA | E37: NSA | F37: NSA | G37: NSA | H37: =RANDBETWEEN(16161616,61616161) -> 47065355 | I37: =RC[-1]+873421 -> 47938776
A38: CASASBAHIASA | B38: 14 | C38: 52288852 | D38: NSA | E38: NSA | F38: NSA | G38: NSA | H38: =RANDBETWEEN(16161616,61616161) -> 47897099 | I38: =RC[-1]+873421 -> 48770520
A39: CASASBAHIASA | B39: 14 | C39: 50841612 | D39: NSA | E39: NSA | F39: NSA | G39: NSA | H39: =RANDBETWEEN(16161616,61616161) -> 42166575 | I39: =RC[-1]+873421 -> 43039996
A40: CASASBAHIASA | B40: 14 | C40: 38322997 | D40: NSA | E40: NSA | F40: NSA | G40: NSA | H40: =RANDBETWEEN(16161616,61616161) -> 52425485 | I40: =RC[-1]+873421 -> 53298906
A41: CASASBAHIASA | B41: 14 | C41: 63665168 | D41: NSA | E41: NSA | F41: NSA | G41: NSA | H41: =RANDBETWEEN(16161616,61616161) -> 59504527 | I41: =RC[-1]+873421 -> 60377948
A42: CASASBAHIASA | B42: 14 | C42: 61163168 | D42: NSA | E42: NSA | F42: NSA | G42: NSA | H42: =RANDBETWEEN(16161616,61616161) -> 28819962 | I42: =RC[-1]+873421 -> 29693383
A43: CASASBAHIASA | B43: 14 | C43: 57006001 | D43: NSA | E43: NSA | F43: NSA | G43: NSA | H43: =RANDBETWEEN(16161616,61616161) -> 48995732 | I43: =RC[-1]+873421 -> 49869153
A44: CASASBAHIASA | B44: 14 | C44: 39228313 | D44: NSA | E44: NSA | F44: NSA | G44: NSA | H44: =RANDBETWEEN(16161616,61616161) -> 59247116 | I44: =RC[-1]+873421 -> 60120537
A45: CASASBAHIASA | B45: 14 | C45: 42622963 | D45: NSA | E45: NSA | F45: NSA | G45: NSA | H45: =RANDBETWEEN(16161616,61616161) -> 41998898 | I45: =RC[-1]+873421 -> 42872319
A46: CASASBAHIASA | B46: 14 | C46: 80962544 | D46: NSA | E46: NSA | F46: NSA | G46: NSA | H46: =RANDBETWEEN(16161616,61616161) -> 39594085 | I46: =RC[-1]+873421 -> 40467506
A47: CASASBAHIASA | B47: 14 | C47: 64821262 | D47: NSA | E47: NSA | F47: NSA | G47: NSA | H47: =RANDBETWEEN(16161616,61616161) -> 38340316 | I47: =RC[-1]+873421 -> 39213737
A48: CASASBAHIASA | B48: 14 | C48: 35902935 | D48: NSA | E48: NSA | F48: NSA | G48: NSA | H48: =RANDBETWEEN(16161616,61616161) -> 24144744 | I48: =RC[-1]+873421 -> 25018165
A49: CASASBAHIASA | B49: 14 | C49: 42182632 | D49: NSA | E49: NSA | F49: NSA | G49: NSA | H49: =RANDBETWEEN(16161616,61616161) -> 50821013 | I49: =RC[-1]+873421 -> 51694434
A50: CASASBAHIASA | B50: 14 | C50: 33523683 | D50: NSA | E50: NSA | F50: NSA | G50: NSA | H50: =RANDBETWEEN(16161616,61616161) -> 41956353 | I50: =RC[-1]+873421 -> 42829774
A51: CASASBAHIASA | B51: 14 | C51: 20074811 | D51: NSA | E51: NSA | F51: NSA | G51: NSA | H51: =RANDBETWEEN(16161616,61616161) -> 35965701 | I51: =RC[-1]+873421 -> 36839122
A52: CASASBAHIASA | B52: 14 | C52: 47916694 | D52: NSA | E52: NSA | F52: NSA | G52: NSA | H52: =RANDBETWEEN(16161616,61616161) -> 39474272 | I52: =RC[-1]+873421 -> 40347693
A53: CASASBAHIASA | B53: 14 | C53: 29605130 | D53: NSA | E53: NSA | F53: NSA | G53: NSA | H53: =RANDBETWEEN(16161616,61616161) -> 56063680 | I53: =RC[-1]+873421 -> 56937101
A54: CASASBAHIASA | B54: 14 | C54: 69069763 | D54: NSA | E54: NSA | F54: NSA | G54: NSA | H54: =RANDBETWEEN(16161616,61616161) -> 33699808 | I54: =RC[-1]+873421 -> 34573229
A55: CASASBAHIASA | B55: 14 | C55: 74935839 | D55: NSA | E55: NSA | F55: NSA | G55: NSA | H55: =RANDBETWEEN(16161616,61616161) -> 41233717 | I55: =RC[-1]+873421 -> 42107138
A56: CASASBAHIASA | B56: 14 | C56: 26417306 | D56: NSA | E56: NSA | F56: NSA | G56: NSA | H56: =RANDBETWEEN(16161616,61616161) -> 26724146 | I56: =RC[-1]+873421 -> 27597567
A57: CASASBAHIASA | B57: 14 | C57: 74529759 | D57: NSA | E57: NSA | F57: NSA | G57: NSA | H57: =RANDBETWEEN(16161616,61616161) -> 17433748 | I57: =RC[-1]+873421 -> 18307169
A58: CASASBAHIASA | B58: 14 | C58: 25250986 | D58: NSA | E58: NSA | F58: NSA | G58: NSA | H58: =RANDBETWEEN(16161616,61616161) -> 23644217 | I58: =RC[-1]+873421 -> 24517638
A59: CASASBAHIASA | B59: 14 | C59: 34142065 | D59: NSA | E59: NSA | F59: NSA | G59: NSA | H59: =RANDBETWEEN(16161616,61616161) -> 23902031 | I59: =RC[-1]+873421 -> 24775452
A60: CASASBAHIASA | B60: 14 | C60: 80550468 | D60: NSA | E60: NSA | F60: NSA | G60: NSA | H60: =RANDBETWEEN(16161616,61616161) -> 29887890 | I60: =RC[-1]+873421 -> 30761311
A61: CASASBAHIASA | B61: 14 | C61: 79223824 | D61: NSA | E61: NSA | F61: NSA | G61: NSA | H61: =RANDBETWEEN(16161616,61616161) -> 22209801 | I61: =RC[-1]+873421 -> 23083222
A62: CASASBAHIASA | B62: 14 | C62: 32272290 | D62: NSA | E62: NSA | F62: NSA | G62: NSA | H62: =RANDBETWEEN(16161616,61616161) -> 36423096 | I62: =RC[-1]+873421 -> 37296517
A63: CASASBAHIASA | B63: 14 | C63: 30597672 | D63: NSA | E63: NSA | F63: NSA | G63: NSA | H63: =RANDBETWEEN(16161616,61616161) -> 33613448 | I63: =RC[-1]+873421 -> 34486869
A64: CASASBAHIASA | B64: 14 | C64: 50572411 | D64: NSA | E64: NSA | F64: NSA | G64: NSA | H64: =RANDBETWEEN(16161616,61616161) -> 52589476 | I64: =RC[-1]+873421 -> 53462897
A65: CASASBAHIASA | B65: 14 | C65: 75381755 | D65: NSA | E65: NSA | F65: NSA | G65: NSA | H65: =RANDBETWEEN(16161616,61616161) -> 42956968 | I65: =RC[-1]+873421 -> 43830389
A66: CASASBAHIASA | B66: 14 | C66: 47032967 | D66: NSA | E66: NSA | F66: NSA | G66: NSA | H66: =RANDBETWEEN(16161616,61616161) -> 25403897 | I66: =RC[-1]+873421 -> 26277318
A67: CASASBAHIASA | B67: 14 | C67: 80926889 | D67: NSA | E67: NSA | F67: NSA | G67: NSA | H67: =RANDBETWEEN(16161616,61616161) -> 45390198 | I67: =RC[-1]+873421 -> 46263619
A68: CASASBAHIASA | B68: 14 | C68: 35279451 | D68: NSA | E68: NSA | F68: NSA | G68: NSA | H68: =RANDBETWEEN(16161616,61616161) -> 22931662 | I68: =RC[-1]+873421 -> 23805083
A69: CASASBAHIASA | B69: 14 | C69: 41826127 | D69: NSA | E69: NSA | F69: NSA | G69: NSA | H69: =RANDBETWEEN(16161616,61616161) -> 36531206 | I69: =RC[-1]+873421 -> 37404627
A70: CASASBAHIASA | B70: 14 | C70: 22565150 | D70: NSA | E70: NSA | F70: NSA | G70: NSA | H70: =RANDBETWEEN(16161616,61616161) -> 19013717 | I70: =RC[-1]+873421 -> 19887138
A71: CASASBAHIASA | B71: 14 | C71: 64440888 | D71: NSA | E71: NSA | F71: NSA | G71: NSA | H71: =RANDBETWEEN(16161616,61616161) -> 58349145 | I71: =RC[-1]+873421 -> 59222566
A72: CASASBAHIASA | B72: 14 | C72: 71740244 | D72: NSA | E72: NSA | F72: NSA | G72: NSA | H72: =RANDBETWEEN(16161616,61616161) -> 34057931 | I72: =RC[-1]+873421 -> 34931352
A73: CASASBAHIASA | B73: 14 | C73: 58191046 | D73: NSA | E73: NSA | F73: NSA | G73: NSA | H73: =RANDBETWEEN(16161616,61616161) -> 22599952 | I73: =RC[-1]+873421 -> 23473373
A74: CASASBAHIASA | B74: 14 | C74: 19450995 | D74: NSA | E74: NSA | F74: NSA | G74: NSA | H74: =RANDBETWEEN(16161616,61616161) -> 41397374 | I74: =RC[-1]+873421 -> 42270795
A75: CASASBAHIASA | B75: 14 | C75: 51830815 | D75: NSA | E75: NSA | F75: NSA | G75: NSA | H75: =RANDBETWEEN(16161616,61616161) -> 32592627 | I75: =RC[-1]+873421 -> 33466048
A76: CASASBAHIASA | B76: 14 | C76: 44383096 | D76: NSA | E76: NSA | F76: NSA | G76: NSA | H76: =RANDBETWEEN(16161616,61616161) -> 32635443 | I76: =RC[-1]+873421 -> 33508864
A77: CASASBAHIASA | B77: 14 | C77: 57431426 | D77: NSA | E77: NSA | F77: NSA | G77: NSA | H77: =RANDBETWEEN(16161616,61616161) -> 21205527 | I77: =RC[-1]+873421 -> 22078948
A78: CASASBAHIASA | B78: 14 | C78: 48868197 | D78: NSA | E78: NSA | F78: NSA | G78: NSA | H78: =RANDBETWEEN(16161616,61616161) -> 60560034 | I78: =RC[-1]+873421 -> 61433455
A79: CASASBAHIASA | B79: 14 | C79: 45928885 | D79: NSA | E79: NSA | F79: NSA | G79: NSA | H79: =RANDBETWEEN(16161616,61616161) -> 60843869 | I79: =RC[-1]+873421 -> 61717290
A80: CASASBAHIASA | B80: 14 | C80: 28309142 | D80: NSA | E80: NSA | F80: NSA | G80: NSA | H80: =RANDBETWEEN(16161616,61616161) -> 60257588 | I80: =RC[-1]+873421 -> 61131009
A81: CASASBAHIASA | B81: 14 | C81: 46843481 | D81: NSA | E81: NSA | F81: NSA | G81: NSA | H81: =RANDBETWEEN(16161616,61616161) -> 32305339 | I81: =RC[-1]+873421 -> 33178760
A82: CASASBAHIASA | B82: 14 | C82: 52798845 | D82: NSA | E82: NSA | F82: NSA | G82: NSA | H82: =RANDBETWEEN(16161616,61616161) -> 23980708 | I82: =RC[-1]+873421 -> 24854129
A83: CASASBAHIASA | B83: 14 | C83: 60283310 | D83: NSA | E83: NSA | F83: NSA | G83: NSA | H83: =RANDBETWEEN(16161616,61616161) -> 16406922 | I83: =RC[-1]+873421 -> 17280343
A84: CASASBAHIASA | B84: 14 | C84: 75477039 | D84: NSA | E84: NSA | F84: NSA | G84: NSA | H84: =RANDBETWEEN(16161616,61616161) -> 42157628 | I84: =RC[-1]+873421 -> 43031049
A85: CASASBAHIASA | B85: 14 | C85: 30556680 | D85: NSA | E85: NSA | F85: NSA | G85: NSA | H85: =RANDBETWEEN(16161616,61616161) -> 52395993 | I85: =RC[-1]+873421 -> 53269414
A86: CASASBAHIASA | B86: 14 | C86: 80835044 | D86: NSA | E86: NSA | F86: NSA | G86: NSA | H86: =RANDBETWEEN(16161616,61616161) -> 33485534 | I86: =RC[-1]+873421 -> 34358955
A87: CASASBAHIASA | B87: 14 | C87: 31200111 | D87: NSA | E87: NSA | F87: NSA | G87: NSA | H87: =RANDBETWEEN(16161616,61616161) -> 61214564 | I87: =RC[-1]+873421 -> 62087985
A88: CASASBAHIASA | B88: 14 | C88: 49016006 | D88: NSA | E88: NSA | F88: NSA | G88: NSA | H88: =RANDBETWEEN(16161616,61616161) -> 47988086 | I88: =RC[-1]+873421 -> 48861507
A89: CASASBAHIASA | B89: 14 | C89: 35462005 | D89: NSA | E89: NSA | F89: NSA | G89: NSA | H89: =RANDBETWEEN(16161616,61616161) -> 61565842 | I89: =RC[-1]+873421 -> 62439263
A90: CASASBAHIASA | B90: 14 | C90: 79261679 | D90: NSA | E90: NSA | F90: NSA | G90: NSA | H90: =RANDBETWEEN(16161616,61616161) -> 22920912 | I90: =RC[-1]+873421 -> 23794333
A91: CASASBAHIASA | B91: 14 | C91: 56155235 | D91: NSA | E91: NSA | F91: NSA | G91: NSA | H91: =RANDBETWEEN(16161616,61616161) -> 51125076 | I91: =RC[-1]+873421 -> 51998497
A92: CASASBAHIASA | B92: 14 | C92: 64188198 | D92: NSA | E92: NSA | F92: NSA | G92: NSA | H92: =RANDBETWEEN(16161616,61616161) -> 43502825 | I92: =RC[-1]+873421 -> 44376246
A93: CASASBAHIASA | B93: 14 | C93: 38210853 | D93: NSA | E93: NSA | F93: NSA | G93: NSA | H93: =RANDBETWEEN(16161616,61616161) -> 39701803 | I93: =RC[-1]+873421 -> 40575224
A94: CASASBAHIASA | B94: 14 | C94: 64300145 | D94: NSA | E94: NSA | F94: NSA | G94: NSA | H94: =RANDBETWEEN(16161616,61616161) -> 26472389 | I94: =RC[-1]+873421 -> 27345810
A95: CASASBAHIASA | B95: 14 | C95: 61739669 | D95: NSA | E95: NSA | F95: NSA | G95: NSA | H95: =RANDBETWEEN(16161616,61616161) -> 29019686 | I95: =RC[-1]+873421 -> 29893107
A96: CASASBAHIASA | B96: 14 | C96: 71448297 | D96: NSA | E96: NSA | F96: NSA | G96: NSA | H96: =RANDBETWEEN(16161616,61616161) -> 30337827 | I96: =RC[-1]+873421 -> 31211248
A97: CASASBAHIASA | B97: 14 | C97: 50740299 | D97: NSA | E97: NSA | F97: NSA | G97: NSA | H97: =RANDBETWEEN(16161616,61616161) -> 43060870 | I97: =RC[-1]+873421 -> 43934291
A98: CASASBAHIASA | B98: 14 | C98: 39024906 | D98: NSA | E98: NSA | F98: NSA | G98: NSA | H98: =RANDBETWEEN(16161616,61616161) -> 59446376 | I98: =RC[-1]+873421 -> 60319797
A99: CASASBAHIASA | B99: 14 | C99: 49014278 | D99: NSA | E99: NSA | F99: NSA | G99: NSA | H99: =RANDBETWEEN(16161616,61616161) -> 59926308 | I99: =RC[-1]+873421 -> 60799729
A100: CASASBAHIASA | B100: 14 | C100: 74832980 | D100: NSA | E100: NSA | F100: NSA | G100: NSA | H100: =RANDBETWEEN(16161616,61616161) -> 26114418 | I100: =RC[-1]+873421 -> 26987839
A101: CASASBAHIASA | B101: 14 | C101: 65288397 | D101: NSA | E101: NSA | F101: NSA | G101: NSA | H101: =RANDBETWEEN(16161616,61616161) -> 41404315 | I101: =RC[-1]+873421 -> 42277736
A102: CASASBAHIASA | B102: 14 | C102: 35156516 | D102: NSA | E102: NSA | F102: NSA | G102: NSA | H102: =RANDBETWEEN(16161616,61616161) -> 23368191 | I102: =RC[-1]+873421 -> 24241612
A103: CASASBAHIASA | B103: 14 | C103: 69838622 | D103: NSA | E103: NSA | F103: NSA | G103: NSA | H103: =RANDBETWEEN(16161616,61616161) -> 36772854 | I103: =RC[-1]+873421 -> 37646275
A104: CASASBAHIASA | B104: 14 | C104: 28852736 | D104: NSA | E104: NSA | F104: NSA | G104: NSA | H104: =RANDBETWEEN(16161616,61616161) -> 42115166 | I104: =RC[-1]+873421 -> 42988587
A105: CASASBAHIASA | B105: 14 | C105: 45433537 | D105: NSA | E105: NSA | F105: NSA | G105: NSA | H105: =RANDBETWEEN(16161616,61616161) -> 49925825 | I105: =RC[-1]+873421 -> 50799246
A106: CASASBAHIASA | B106: 14 | C106: 61836189 | D106: NSA | E106: NSA | F106: NSA | G106: NSA | H106: =RANDBETWEEN(16161616,61616161) -> 46634429 | I106: =RC[-1]+873421 -> 47507850
A107: CASASBAHIASA | B107: 14 | C107: 61750464 | D107: NSA | E107: NSA | F107: NSA | G107: NSA | H107: =RANDBETWEEN(16161616,61616161) -> 52506141 | I107: =RC[-1]+873421 -> 53379562
A108: CASASBAHIASA | B108: 14 | C108: 58282392 | D108: NSA | E108: NSA | F108: NSA | G108: NSA | H108: =RANDBETWEEN(16161616,61616161) -> 38986802 | I108: =RC[-1]+873421 -> 39860223
A109: CASASBAHIASA | B109: 14 | C109: 38859925 | D109: NSA | E109: NSA | F109: NSA | G109: NSA | H109: =RANDBETWEEN(16161616,61616161) -> 35227324 | I109: =RC[-1]+873421 -> 36100745
A110: CASASBAHIASA | B110: 14 | C110: 47032732 | D110: NSA | E110: NSA | F110: NSA | G110: NSA | H110: =RANDBETWEEN(16161616,61616161) -> 16250945 | I110: =RC[-1]+873421 -> 17124366
A111: CASASBAHIASA | B111: 14 | C111: 45252567 | D111: NSA | E111: NSA | F111: NSA | G111: NSA | H111: =RANDBETWEEN(16161616,61616161) -> 19340004 | I111: =RC[-1]+873421 -> 20213425
A112: CASASBAHIASA | B112: 14 | C112: 31999808 | D112: NSA | E112: NSA | F112: NSA | G112: NSA | H112: =RANDBETWEEN(16161616,61616161) -> 53852648 | I112: =RC[-1]+873421 -> 54726069
A113: CASASBAHIASA | B113: 14 | C113: 51154696 | D113: NSA | E113: NSA | F113: NSA | G113: NSA | H113: =RANDBETWEEN(16161616,61616161) -> 48117165 | I113: =RC[-1]+873421 -> 48990586
A114: CASASBAHIASA | B114: 14 | C114: 50051417 | D114: NSA | E114: NSA | F114: NSA | G114: NSA | H114: =RANDBETWEEN(16161616,61616161) -> 38128445 | I114: =RC[-1]+873421 -> 39001866
A115: CASASBAHIASA | B115: 14 | C115: 23257654 | D115: NSA | E115: NSA | F115: NSA | G115: NSA | H115: =RANDBETWEEN(16161616,61616161) -> 36357207 | I115: =RC[-1]+873421 -> 37230628
A116: CASASBAHIASA | B116: 14 | C116: 64786922 | D116: NSA | E116: NSA | F116: NSA | G116: NSA | H116: =RANDBETWEEN(16161616,61616161) -> 38674549 | I116: =RC[-1]+873421 -> 39547970
A117: CASASBAHIASA | B117: 14 | C117: 24128632 | D117: NSA | E117: NSA | F117: NSA | G117: NSA | H117: =RANDBETWEEN(16161616,61616161) -> 37462593 | I117: =RC[-1]+873421 -> 38336014
A118: CASASBAHIASA | B118: 14 | C118: 78549390 | D118: NSA | E118: NSA | F118: NSA | G118: NSA | H118: =RANDBETWEEN(16161616,61616161) -> 19474923 | I118: =RC[-1]+873421 -> 20348344
A119: CASASBAHIASA | B119: 14 | C119: 44260153 | D119: NSA | E119: NSA | F119: NSA | G119: NSA | H119: =RANDBETWEEN(16161616,61616161) -> 25890311 | I119: =RC[-1]+873421 -> 26763732
A120: CASASBAHIASA | B120: 14 | C120: 50712348 | D120: NSA | E120: NSA | F120: NSA | G120: NSA | H120: =RANDBETWEEN(16161616,61616161) -> 53254465 | I120: =RC[-1]+873421 -> 54127886
A121: CASASBAHIASA | B121: 14 | C121: 55500160 | D121: NSA | E121: NSA | F121: NSA | G121: NSA | H121: =RANDBETWEEN(16161616,61616161) -> 36830194 | I121: =RC[-1]+873421 -> 37703615
A122: CASASBAHIASA | B122: 14 | C122: 49115063 | D122: NSA | E122: NSA | F122: NSA | G122: NSA | H122: =RANDBETWEEN(16161616,61616161) -> 42870867 | I122: =RC[-1]+873421 -> 43744288
A123: CASASBAHIASA | B123: 14 | C123: 22115205 | D123: NSA | E123: NSA | F123: NSA | G123: NSA | H123: =RANDBETWEEN(16161616,61616161) -> 33491478 | I123: =RC[-1]+873421 -> 34364899
A124: CASASBAHIASA | B124: 14 | C124: 62942689 | D124: NSA | E124: NSA | F124: NSA | G124: NSA | H124: =RANDBETWEEN(16161616,61616161) -> 45848276 | I124: =RC[-1]+873421 -> 46721697
A125: CASASBAHIASA | B125: 14 | C125: 76149742 | D125: NSA | E125: NSA | F125: NSA | G125: NSA | H125: =RANDBETWEEN(16161616,61616161) -> 20377761 | I125: =RC[-1]+873421 -> 21251182
A126: CASASBAHIASA | B126: 14 | C126: 49315443 | D126: NSA | E126: NSA | F126: NSA | G126: NSA | H126: =RANDBETWEEN(16161616,61616161) -> 25517854 | I126: =RC[-1]+873421 -> 26391275
A127: CASASBAHIASA | B127: 14 | C127: 72386075 | D127: NSA | E127: NSA | F127: NSA | G127: NSA | H127: =RANDBETWEEN(16161616,61616161) -> 20535246 | I127: =RC[-1]+873421 -> 21408667
A128: CASASBAHIASA | B128: 14 | C128: 78934751 | D128: NSA | E128: NSA | F128: NSA | G128: NSA | H128: =RANDBETWEEN(16161616,61616161) -> 25845113 | I128: =RC[-1]+873421 -> 26718534
A129: CASASBAHIASA | B129: 14 | C129: 44631682 | D129: NSA | E129: NSA | F129: NSA | G129: NSA | H129: =RANDBETWEEN(16161616,61616161) -> 40855354 | I129: =RC[-1]+873421 -> 41728775
A130: CASASBAHIASA | B130: 14 | C130: 28712115 | D130: NSA | E130: NSA | F130: NSA | G130: NSA | H130: =RANDBETWEEN(16161616,61616161) -> 26675857 | I130: =RC[-1]+873421 -> 27549278
A131: CASASBAHIASA | B131: 14 | C131: 25893982 | D131: NSA | E131: NSA | F131: NSA | G131: NSA | H131: =RANDBETWEEN(16161616,61616161) -> 39583049 | I131: =RC[-1]+873421 -> 40456470
A132: CASASBAHIASA | B132: 14 | C132: 63841938 | D132: NSA | E132: NSA | F132: NSA | G132: NSA | H132: =RANDBETWEEN(16161616,61616161) -> 35188389 | I132: =RC[-1]+873421 -> 36061810
A133: CASASBAHIASA | B133: 14 | C133: 23613216 | D133: NSA | E133: NSA | F133: NSA | G133: NSA | H133: =RANDBETWEEN(16161616,61616161) -> 58167041 | I133: =RC[-1]+873421 -> 59040462
A134: CASASBAHIASA | B134: 14 | C134: 44879818 | D134: NSA | E134: NSA | F134: NSA | G134: NSA | H134: =RANDBETWEEN(16161616,61616161) -> 34726120 | I134: =RC[-1]+873421 -> 35599541
A135: CASASBAHIASA | B135: 14 | C135: 74643163 | D135: NSA | E135: NSA | F135: NSA | G135: NSA | H135: =RANDBETWEEN(16161616,61616161) -> 27443651 | I135: =RC[-1]+873421 -> 28317072
A136: CASASBAHIASA | B136: 14 | C136: 20280038 | D136: NSA | E136: NSA | F136: NSA | G136: NSA | H136: =RANDBETWEEN(16161616,61616161) -> 23801744 | I136: =RC[-1]+873421 -> 24675165
A137: CASASBAHIASA | B137: 14 | C137: 49961805 | D137: NSA | E137: NSA | F137: NSA | G137: NSA | H137: =RANDBETWEEN(16161616,61616161) -> 22632147 | I137: =RC[-1]+873421 -> 23505568
A138: CASASBAHIASA | B138: 14 | C138: 34326168 | D138: NSA | E138: NSA | F138: NSA | G138: NSA | H138: =RANDBETWEEN(16161616,61616161) -> 37727056 | I138: =RC[-1]+873421 -> 38600477
A139: CASASBAHIASA | B139: 14 | C139: 57810130 | D139: NSA | E139: NSA | F139: NSA | G139: NSA | H139: =RANDBETWEEN(16161616,61616161) -> 28197897 | I139: =RC[-1]+873421 -> 29071318
A140: CASASBAHIASA | B140: 14 | C140: 73535686 | D140: NSA | E140: NSA | F140: NSA | G140: NSA | H140: =RANDBETWEEN(16161616,61616161) -> 22106776 | I140: =RC[-1]+873421 -> 22980197
A141: CASASBAHIASA | B141: 14 | C141: 79648646 | D141: NSA | E141: NSA | F141: NSA | G141: NSA | H141: =RANDBETWEEN(16161616,61616161) -> 39967246 | I141: =RC[-1]+873421 -> 40840667
A142: CASASBAHIASA | B142: 14 | C142: 23279159 | D142: NSA | E142: NSA | F142: NSA | G142: NSA | H142: =RANDBETWEEN(16161616,61616161) -> 18885926 | I142: =RC[-1]+873421 -> 19759347
A143: CASASBAHIASA | B143: 14 | C143: 47733003 | D143: NSA | E143: NSA | F143: NSA | G143: NSA | H143: =RANDBETWEEN(16161616,61616161) -> 21176349 | I143: =RC[-1]+873421 -> 22049770
A144: CASASBAHIASA | B144: 14 | C144: 71075078 | D144: NSA | E144: NSA | F144: NSA | G144: NSA | H144: =RANDBETWEEN(16161616,61616161) -> 36821872 | I144: =RC[-1]+873421 -> 37695293
A145: CASASBAHIASA | B145: 14 | C145: 56817657 | D145: NSA | E145: NSA | F145: NSA | G145: NSA | H145: =RANDBETWEEN(16161616,61616161) -> 53616747 | I145: =RC[-1]+873421 -> 54490168
A146: CASASBAHIASA | B146: 14 | C146: 73825444 | D146: NSA | E146: NSA | F146: NSA | G146: NSA | H146: =RANDBETWEEN(16161616,61616161) -> 48813862 | I146: =RC[-1]+873421 -> 49687283
A147: CASASBAHIASA | B147: 14 | C147: 27415575 | D147: NSA | E147: NSA | F147: NSA | G147: NSA | H147: =RANDBETWEEN(16161616,61616161) -> 20566337 | I147: =RC[-1]+873421 -> 21439758
A148: CASASBAHIASA | B148: 14 | C148: 42119104 | D148: NSA | E148: NSA | F148: NSA | G148: NSA | H148: =RANDBETWEEN(16161616,61616161) -> 58822323 | I148: =RC[-1]+873421 -> 59695744
A149: CASASBAHIASA | B149: 14 | C149: 24646912 | D149: NSA | E149: NSA | F149: NSA | G149: NSA | H149: =RANDBETWEEN(16161616,61616161) -> 17682630 | I149: =RC[-1]+873421 -> 18556051
A150: CASASBAHIASA | B150: 14 | C150: 58660057 | D150: NSA | E150: NSA | F150: NSA | G150: NSA | H150: =RANDBETWEEN(16161616,61616161) -> 57844921 | I150: =RC[-1]+873421 -> 58718342
A151: CASASBAHIASA | B151: 14 | C151: 55778685 | D151: NSA | E151: NSA | F151: NSA | G151: NSA | H151: =RANDBETWEEN(16161616,61616161) -> 44739693 | I151: =RC[-1]+873421 -> 45613114
A152: CASASBAHIASA | B152: 14 | C152: 35206062 | D152: NSA | E152: NSA | F152: NSA | G152: NSA | H152: =RANDBETWEEN(16161616,61616161) -> 24571149 | I152: =RC[-1]+873421 -> 25444570
A153: CASASBAHIASA | B153: 14 | C153: 62636008 | D153: NSA | E153: NSA | F153: NSA | G153: NSA | H153: =RANDBETWEEN(16161616,61616161) -> 18349958 | I153: =RC[-1]+873421 -> 19223379
A154: CASASBAHIASA | B154: 14 | C154: 26293657 | D154: NSA | E154: NSA | F154: NSA | G154: NSA | H154: =RANDBETWEEN(16161616,61616161) -> 44886531 | I154: =RC[-1]+873421 -> 45759952
A155: CASASBAHIASA | B155: 14 | C155: 79129296 | D155: NSA | E155: NSA | F155: NSA | G155: NSA | H155: =RANDBETWEEN(16161616,61616161) -> 17030936 | I155: =RC[-1]+873421 -> 17904357
A156: CASASBAHIASA | B156: 14 | C156: 72259541 | D156: NSA | E156: NSA | F156: NSA | G156: NSA | H156: =RANDBETWEEN(16161616,61616161) -> 30897586 | I156: =RC[-1]+873421 -> 31771007
A157: CASASBAHIASA | B157: 14 | C157: 39723102 | D157: NSA | E157: NSA | F157: NSA | G157: NSA | H157: =RANDBETWEEN(16161616,61616161) -> 29272186 | I157: =RC[-1]+873421 -> 30145607
A158: CASASBAHIASA | B158: 14 | C158: 25619218 | D158: NSA | E158: NSA | F158: NSA | G158: NSA | H158: =RANDBETWEEN(16161616,61616161) -> 31697113 | I158: =RC[-1]+873421 -> 32570534
A159: CASASBAHIASA | B159: 14 | C159: 24811090 | D159: NSA | E159: NSA | F159: NSA | G159: NSA | H159: =RANDBETWEEN(16161616,61616161) -> 37228828 | I159: =RC[-1]+873421 -> 38102249
A160: CASASBAHIASA | B160: 14 | C160: 18450672 | D160: NSA | E160: NSA | F160: NSA | G160: NSA | H160: =RANDBETWEEN(16161616,61616161) -> 32868161 | I160: =RC[-1]+873421 -> 33741582
A161: CASASBAHIASA | B161: 14 | C161: 18381491 | D161: NSA | E161: NSA | F161: NSA | G161: NSA | H161: =RANDBETWEEN(16161616,61616161) -> 34224550 | I161: =RC[-1]+873421 -> 35097971
A162: CASASBAHIASA | B162: 14 | C162: 20308244 | D162: NSA | E162: NSA | F162: NSA | G162: NSA | H162: =RANDBETWEEN(16161616,61616161) -> 48149881 | I162: =RC[-1]+873421 -> 49023302
A163: CASASBAHIASA | B163: 14 | C163: 77255043 | D163: NSA | E163: NSA | F163: NSA | G163: NSA | H163: =RANDBETWEEN(16161616,61616161) -> 60621006 | I163: =RC[-1]+873421 -> 61494427
A164: CASASBAHIASA | B164: 14 | C164: 47061920 | D164: NSA | E164: NSA | F164: NSA | G164: NSA | H164: =RANDBETWEEN(16161616,61616161) -> 46511268 | I164: =RC[-1]+873421 -> 47384689
A165: CASASBAHIASA | B165: 14 | C165: 68898855 | D165: NSA | E165: NSA | F165: NSA | G165: NSA | H165: =RANDBETWEEN(16161616,61616161) -> 26787553 | I165: =RC[-1]+873421 -> 27660974
A166: CASASBAHIASA | B166: 14 | C166: 23836395 | D166: NSA | E166: NSA | F166: NSA | G166: NSA | H166: =RANDBETWEEN(16161616,61616161) -> 53081979 | I166: =RC[-1]+873421 -> 53955400
A167: CASASBAHIASA | B167: 14 | C167: 53642530 | D167: NSA | E167: NSA | F167: NSA | G167: NSA | H167: =RANDBETWEEN(16161616,61616161) -> 48042660 | I167: =RC[-1]+873421 -> 48916081
A168: CASASBAHIASA | B168: 14 | C168: 77051888 | D168: NSA | E168: NSA | F168: NSA | G168: NSA | H168: =RANDBETWEEN(16161616,61616161) -> 22060348 | I168: =RC[-1]+873421 -> 22933769
A169: CASASBAHIASA | B169: 14 | C169: 78126821 | D169: NSA | E169: NSA | F169: NSA | G169: NSA | H169: =RANDBETWEEN(16161616,61616161) -> 47660201 | I169: =RC[-1]+873421 -> 48533622
A170: CASASBAHIASA | B170: 14 | C170: 31653013 | D170: NSA | E170: NSA | F170: NSA | G170: NSA | H170: =RANDBETWEEN(16161616,61616161) -> 43508753 | I170: =RC[-1]+873421 -> 44382174
A171: CASASBAHIASA | B171: 14 | C171: 21490539 | D171: NSA | E171: NSA | F171: NSA | G171: NSA | H171: =RANDBETWEEN(16161616,61616161) -> 45189001 | I171: =RC[-1]+873421 -> 46062422
A172: CASASBAHIASA | B172: 14 | C172: 55613539 | D172: NSA | E172: NSA | F172: NSA | G172: NSA | H172: =RANDBETWEEN(16161616,61616161) -> 57484762 | I172: =RC[-1]+873421 -> 58358183
A173: CASASBAHIASA | B173: 14 | C173: 20699841 | D173: NSA | E173: NSA | F173: NSA | G173: NSA | H173: =RANDBETWEEN(16161616,61616161) -> 45176426 | I173: =RC[-1]+873421 -> 46049847
A174: CASASBAHIASA | B174: 14 | C174: 61317579 | D174: NSA | E174: NSA | F174: NSA | G174: NSA | H174: =RANDBETWEEN(16161616,61616161) -> 16898946 | I174: =RC[-1]+873421 -> 17772367
A175: CASASBAHIASA | B175: 14 | C175: 70651681 | D175: NSA | E175: NSA | F175: NSA | G175: NSA | H175: =RANDBETWEEN(16161616,61616161) -> 58987393 | I175: =RC[-1]+873421 -> 59860814
A176: CASASBAHIASA | B176: 14 | C176: 58276056 | D176: NSA | E176: NSA | F176: NSA | G176: NSA | H176: =RANDBETWEEN(16161616,61616161) -> 36303747 | I176: =RC[-1]+873421 -> 37177168
A177: CASASBAHIASA | B177: 14 | C177: 53365507 | D177: NSA | E177: NSA | F177: NSA | G177: NSA | H177: =RANDBETWEEN(16161616,61616161) -> 40040574 | I177: =RC[-1]+873421 -> 40913995
A178: CASASBAHIASA | B178: 14 | C178: 55718203 | D178: NSA | E178: NSA | F178: NSA | G178: NSA | H178: =RANDBETWEEN(16161616,61616161) -> 24535152 | I178: =RC[-1]+873421 -> 25408573
A179: CASASBAHIASA | B179: 14 | C179: 34270551 | D179: NSA | E179: NSA | F179: NSA | G179: NSA | H179: =RANDBETWEEN(16161616,61616161) -> 45489499 | I179: =RC[-1]+873421 -> 46362920
A180: CASASBAHIASA | B180: 14 | C180: 33579010 | D180: NSA | E180: NSA | F180: NSA | G180: NSA | H180: =RANDBETWEEN(16161616,61616161) -> 48006038 | I180: =RC[-1]+873421 -> 48879459
A181: CASASBAHIASA | B181: 14 | C181: 55764255 | D181: NSA | E181: NSA | F181: NSA | G181: NSA | H181: =RANDBETWEEN(16161616,61616161) -> 29674924 | I181: =RC[-1]+873421 -> 30548345
A182: CASASBAHIASA | B182: 14 | C182: 62085662 | D182: NSA | E182: NSA | F182: NSA | G182: NSA | H182: =RANDBETWEEN(16161616,61616161) -> 49897268 | I182: =RC[-1]+873421 -> 50770689
A183: CASASBAHIASA | B183: 14 | C183: 64136805 | D183: NSA | E183: NSA | F183: NSA | G183: NSA | H183: =RANDBETWEEN(16161616,61616161) -> 25540255 | I183: =RC[-1]+873421 -> 26413676
A184: CASASBAHIASA | B184: 14 | C184: 53157381 | D184: NSA | E184: NSA | F184: NSA | G184: NSA | H184: =RANDBETWEEN(16161616,61616161) -> 28752356 | I184: =RC[-1]+873421 -> 29625777
A185: CASASBAHIASA | B185: 14 | C185: 41886926 | D185: NSA | E185: NSA | F185: NSA | G185: NSA | H185: =RANDBETWEEN(16161616,61616161) -> 46594687 | I185: =RC[-1]+873421 -> 47468108
A186: CASASBAHIASA | B186: 14 | C186: 80156304 | D186: NSA | E186: NSA | F186: NSA | G186: NSA | H186: =RANDBETWEEN(16161616,61616161) -> 16973491 | I186: =RC[-1]+873421 -> 17846912
A187: CASASBAHIASA | B187: 14 | C187: 49418217 | D187: NSA | E187: NSA | F187: NSA | G187: NSA | H187: =RANDBETWEEN(16161616,61616161) -> 50282030 | I187: =RC[-1]+873421 -> 51155451
A188: CASASBAHIASA | B188: 14 | C188: 58117201 | D188: NSA | E188: NSA | F188: NSA | G188: NSA | H188: =RANDBETWEEN(16161616,61616161) -> 30066933 | I188: =RC[-1]+873421 -> 30940354
A189: CASASBAHIASA | B189: 14 | C189: 71537902 | D189: NSA | E189: NSA | F189: NSA | G189: NSA | H189: =RANDBETWEEN(16161616,61616161) -> 18895165 | I189: =RC[-1]+873421 -> 19768586
A190: CASASBAHIASA | B190: 14 | C190: 39908845 | D190: NSA | E190: NSA | F190: NSA | G190: NSA | H190: =RANDBETWEEN(16161616,61616161) -> 48180260 | I190: =RC[-1]+873421 -> 49053681
A191: CASASBAHIASA | B191: 14 | C191: 47801876 | D191: NSA | E191: NSA | F191: NSA | G191: NSA | H191: =RANDBETWEEN(16161616,61616161) -> 25298352 | I191: =RC[-1]+873421 -> 26171773
A192: CASASBAHIASA | B192: 14 | C192: 24044520 | D192: NSA | E192: NSA | F192: NSA | G192: NSA | H192: =RANDBETWEEN(16161616,61616161) -> 24709581 | I192: =RC[-1]+873421 -> 25583002
A193: CASASBAHIASA | B193: 14 | C193: 63608017 | D193: NSA | E193: NSA | F193: NSA | G193: NSA | H193: =RANDBETWEEN(16161616,61616161) -> 60912278 | I193: =RC[-1]+873421 -> 61785699
A194: CASASBAHIASA | B194: 14 | C194: 58801178 | D194: NSA | E194: NSA | F194: NSA | G194: NSA | H194: =RANDBETWEEN(16161616,61616161) -> 47954469 | I194: =RC[-1]+873421 -> 48827890
A195: CASASBAHIASA | B195: 14 | C195: 24806781 | D195: NSA | E195: NSA | F195: NSA | G195: NSA | H195: =RANDBETWEEN(16161616,61616161) -> 33852505 | I195: =RC[-1]+873421 -> 34725926
A196: CASASBAHIASA | B196: 14 | C196: 50366702 | D196: NSA | E196: NSA | F196: NSA | G196: NSA | H196: =RANDBETWEEN(16161616,61616161) -> 29514206 | I196: =RC[-1]+873421 -> 30387627
A197: CASASBAHIASA | B197: 14 | C197: 41240170 | D197: NSA | E197: NSA | F197: NSA | G197: NSA | H197: =RANDBETWEEN(16161616,61616161) -> 60883211 | I197: =RC[-1]+873421 -> 61756632
A198: CASASBAHIASA | B198: 14 | C198: 55216676 | D198: NSA | E198: NSA | F198: NSA | G198: NSA | H198: =RANDBETWEEN(16161616,61616161) -> 37440935 | I198: =RC[-1]+873421 -> 38314356
A199: CASASBAHIASA | B199: 14 | C199: 73757689 | D199: NSA | E199: NSA | F199: NSA | G199: NSA | H199: =RANDBETWEEN(16161616,61616161) -> 45856098 | I199: =RC[-1]+873421 -> 46729519
A200: CASASBAHIASA | B200: 14 | C200: 78064940 | D200: NSA | E200: NSA | F200: NSA | G200: NSA | H200: =RANDBETWEEN(16161616,61616161) -> 48552100 | I200: =RC[-1]+873421 -> 49425521
A201: CASASBAHIASA | B201: 14 | C201: 81755662 | D201: NSA | E201: NSA | F201: NSA | G201: NSA | H201: =RANDBETWEEN(16161616,61616161) -> 18044508 | I201: =RC[-1]+873421 -> 18917929
A202: CASASBAHIASA | B202: 14 | C202: 21322072 | D202: NSA | E202: NSA | F202: NSA | G202: NSA | H202: =RANDBETWEEN(16161616,61616161) -> 21444189 | I202: =RC[-1]+873421 -> 22317610
A203: CASASBAHIASA | B203: 14 | C203: 19657092 | D203: NSA | E203: NSA | F203: NSA | G203: NSA | H203: =RANDBETWEEN(16161616,61616161) -> 48864465 | I203: =RC[-1]+873421 -> 49737886
A204: CASASBAHIASA | B204: 14 | C204: 25397931 | D204: NSA | E204: NSA | F204: NSA | G204: NSA | H204: =RANDBETWEEN(16161616,61616161) -> 16443801 | I204: =RC[-1]+873421 -> 17317222
A205: CASASBAHIASA | B205: 14 | C205: 69477097 | D205: NSA | E205: NSA | F205: NSA | G205: NSA | H205: =RANDBETWEEN(16161616,61616161) -> 53869440 | I205: =RC[-1]+873421 -> 54742861
A206: CASASBAHIASA | B206: 14 | C206: 45555252 | D206: NSA | E206: NSA | F206: NSA | G206: NSA | H206: =RANDBETWEEN(16161616,61616161) -> 57605055 | I206: =RC[-1]+873421 -> 58478476
A207: CASASBAHIASA | B207: 14 | C207: 59049659 | D207: NSA | E207: NSA | F207: NSA | G207: NSA | H207: =RANDBETWEEN(16161616,61616161) -> 16781179 | I207: =RC[-1]+873421 -> 17654600
A208: CASASBAHIASA | B208: 14 | C208: 19288582 | D208: NSA | E208: NSA | F208: NSA | G208: NSA | H208: =RANDBETWEEN(16161616,61616161) -> 47031328 | I208: =RC[-1]+873421 -> 47904749
A209: CASASBAHIASA | B209: 14 | C209: 38096359 | D209: NSA | E209: NSA | F209: NSA | G209: NSA | H209: =RANDBETWEEN(16161616,61616161) -> 32355557 | I209: =RC[-1]+873421 -> 33228978
A210: CASASBAHIASA | B210: 14 | C210: 53359706 | D210: NSA | E210: NSA | F210: NSA | G210: NSA | H210: =RANDBETWEEN(16161616,61616161) -> 60506985 | I210: =RC[-1]+873421 -> 61380406
A211: CASASBAHIASA | B211: 14 | C211: 34720163 | D211: NSA | E211: NSA | F211: NSA | G211: NSA | H211: =RANDBETWEEN(16161616,61616161) -> 27933500 | I211: =RC[-1]+873421 -> 28806921
A212: CASASBAHIASA | B212: 14 | C212: 42790426 | D212: NSA | E212: NSA | F212: NSA | G212: NSA | H212: =RANDBETWEEN(16161616,61616161) -> 32647428 | I212: =RC[-1]+873421 -> 33520849
A213: CASASBAHIASA | B213: 14 | C213: 75977235 | D213: NSA | E213: NSA | F213: NSA | G213: NSA | H213: =RANDBETWEEN(16161616,61616161) -> 28584807 | I213: =RC[-1]+873421 -> 29458228
A214: CASASBAHIASA | B214: 14 | C214: 62463775 | D214: NSA | E214: NSA | F214: NSA | G214: NSA | H214: =RANDBETWEEN(16161616,61616161) -> 23973971 | I214: =RC[-1]+873421 -> 24847392
A215: CASASBAHIASA | B215: 14 | C215: 25018524 | D215: NSA | E215: NSA | F215: NSA | G215: NSA | H215: =RANDBETWEEN(16161616,61616161) -> 25104674 | I215: =RC[-1]+873421 -> 25978095
A216: CASASBAHIASA | B216: 14 | C216: 65766851 | D216: NSA | E216: NSA | F216: NSA | G216: NSA | H216: =RANDBETWEEN(16161616,61616161) -> 17072510 | I216: =RC[-1]+873421 -> 17945931
A217: CASASBAHIASA | B217: 14 | C217: 75796529 | D217: NSA | E217: NSA | F217: NSA | G217: NSA | H217: =RANDBETWEEN(16161616,61616161) -> 32505833 | I217: =RC[-1]+873421 -> 33379254
A218: CASASBAHIASA | B218: 14 | C218: 18634382 | D218: NSA | E218: NSA | F218: NSA | G218: NSA | H218: =RANDBETWEEN(16161616,61616161) -> 57879113 | I218: =RC[-1]+873421 -> 58752534
A219: CASASBAHIASA | B219: 14 | C219: 26719838 | D219: NSA | E219: NSA | F219: NSA | G219: NSA | H219: =RANDBETWEEN(16161616,61616161) -> 53380920 | I219: =RC[-1]+873421 -> 54254341
A220: CASASBAHIASA | B220: 14 | C220: 76203997 | D220: NSA | E220: NSA | F220: NSA | G220: NSA | H220: =RANDBETWEEN(16161616,61616161) -> 25381754 | I220: =RC[-1]+873421 -> 26255175
A221: CASASBAHIASA | B221: 14 | C221: 56141826 | D221: NSA | E221: NSA | F221: NSA | G221: NSA | H221: =RANDBETWEEN(16161616,61616161) -> 24921351 | I221: =RC[-1]+873421 -> 25794772
A222: CASASBAHIASA | B222: 14 | C222: 39003360 | D222: NSA | E222: NSA | F222: NSA | G222: NSA | H222: =RANDBETWEEN(16161616,61616161) -> 46829296 | I222: =RC[-1]+873421 -> 47702717
A223: CASASBAHIASA | B223: 14 | C223: 52538457 | D223: NSA | E223: NSA | F223: NSA | G223: NSA | H223: =RANDBETWEEN(16161616,61616161) -> 42309109 | I223: =RC[-1]+873421 -> 43182530
A224: CASASBAHIASA | B224: 14 | C224: 33820560 | D224: NSA | E224: NSA | F224: NSA | G224: NSA | H224: =RANDBETWEEN(16161616,61616161) -> 27216537 | I224: =RC[-1]+873421 -> 28089958
A225: CASASBAHIASA | B225: 14 | C225: 19217117 | D225: NSA | E225: NSA | F225: NSA | G225: NSA | H225: =RANDBETWEEN(16161616,61616161) -> 44739371 | I225: =RC[-1]+873421 -> 45612792
A226: CASASBAHIASA | B226: 14 | C226: 75868299 | D226: NSA | E226: NSA | F226: NSA | G226: NSA | H226: =RANDBETWEEN(16161616,61616161) -> 16305433 | I226: =RC[-1]+873421 -> 17178854
A227: CASASBAHIASA | B227: 14 | C227: 63633943 | D227: NSA | E227: NSA | F227: NSA | G227: NSA | H227: =RANDBETWEEN(16161616,61616161) -> 55868942 | I227: =RC[-1]+873421 -> 56742363
A228: CASASBAHIASA | B228: 14 | C228: 80420898 | D228: NSA | E228: NSA | F228: NSA | G228: NSA | H228: =RANDBETWEEN(16161616,61616161) -> 56837389 | I228: =RC[-1]+873421 -> 57710810
A229: CASASBAHIASA | B229: 14 | C229: 81395329 | D229: NSA | E229: NSA | F229: NSA | G229: NSA | H229: =RANDBETWEEN(16161616,61616161) -> 29218700 | I229: =RC[-1]+873421 -> 30092121
A230: CASASBAHIASA | B230: 14 | C230: 76180994 | D230: NSA | E230: NSA | F230: NSA | G230: NSA | H230: =RANDBETWEEN(16161616,61616161) -> 56985542 | I230: =RC[-1]+873421 -> 57858963
A231: CASASBAHIASA | B231: 14 | C231: 38130070 | D231: NSA | E231: NSA | F231: NSA | G231: NSA | H231: =RANDBETWEEN(16161616,61616161) -> 56330020 | I231: =RC[-1]+873421 -> 57203441
A232: CASASBAHIASA | B232: 14 | C232: 52848481 | D232: NSA | E232: NSA | F232: NSA | G232: NSA | H232: =RANDBETWEEN(16161616,61616161) -> 16598287 | I232: =RC[-1]+873421 -> 17471708
A233: CASASBAHIASA | B233: 14 | C233: 61609399 | D233: NSA | E233: NSA | F233: NSA | G233: NSA | H233: =RANDBETWEEN(16161616,61616161) -> 19511295 | I233: =RC[-1]+873421 -> 20384716
A234: CASASBAHIASA | B234: 14 | C234: 44192128 | D234: NSA | E234: NSA | F234: NSA | G234: NSA | H234: =RANDBETWEEN(16161616,61616161) -> 47942887 | I234: =RC[-1]+873421 -> 48816308
A235: CASASBAHIASA | B235: 14 | C235: 42546187 | D235: NSA | E235: NSA | F235: NSA | G235: NSA | H235: =RANDBETWEEN(16161616,61616161) -> 53297570 | I235: =RC[-1]+873421 -> 54170991
A236: CASASBAHIASA | B236: 14 | C236: 61914256 | D236: NSA | E236: NSA | F236: NSA | G236: NSA | H236: =RANDBETWEEN(16161616,61616161) -> 59785053 | I236: =RC[-1]+873421 -> 60658474
A237: CASASBAHIASA | B237: 14 | C237: 72283411 | D237: NSA | E237: NSA | F237: NSA | G237: NSA | H237: =RANDBETWEEN(16161616,61616161) -> 40876430 | I237: =RC[-1]+873421 -> 41749851
A238: CASASBAHIASA | B238: 14 | C238: 24742850 | D238: NSA | E238: NSA | F238: NSA | G238: NSA | H238: =RANDBETWEEN(16161616,61616161) -> 47000191 | I238: =RC[-1]+873421 -> 47873612
A239: CASASBAHIASA | B239: 14 | C239: 47680129 | D239: NSA | E239: NSA | F239: NSA | G239: NSA | H239: =RANDBETWEEN(16161616,61616161) -> 27545068 | I239: =RC[-1]+873421 -> 28418489
A240: CASASBAHIASA | B240: 14 | C240: 51229486 | D240: NSA | E240: NSA | F240: NSA | G240: NSA | H240: =RANDBETWEEN(16161616,61616161) -> 31076366 | I240: =RC[-1]+873421 -> 31949787
A241: CASASBAHIASA | B241: 14 | C241: 74152337 | D241: NSA | E241: NSA | F241: NSA | G241: NSA | H241: =RANDBETWEEN(16161616,61616161) -> 21956548 | I241: =RC[-1]+873421 -> 22829969
A242: CASASBAHIASA | B242: 14 | C242: 74013779 | D242: NSA | E242: NSA | F242: NSA | G242: NSA | H242: =RANDBETWEEN(16161616,61616161) -> 51444251 | I242: =RC[-1]+873421 -> 52317672
A243: CASASBAHIASA | B243: 14 | C243: 63766707 | D243: NSA | E243: NSA | F243: NSA | G243: NSA | H243: =RANDBETWEEN(16161616,61616161) -> 39375161 | I243: =RC[-1]+873421 -> 40248582
A244: CASASBAHIASA | B244: 14 | C244: 80470824 | D244: NSA | E244: NSA | F244: NSA | G244: NSA | H244: =RANDBETWEEN(16161616,61616161) -> 31331805 | I244: =RC[-1]+873421 -> 32205226
A245: CASASBAHIASA | B245: 14 | C245: 64182209 | D245: NSA | E245: NSA | F245: NSA | G245: NSA | H245: =RANDBETWEEN(16161616,61616161) -> 34005211 | I245: =RC[-1]+873421 -> 34878632
A246: CASASBAHIASA | B246: 14 | C246: 22244027 | D246: NSA | E246: NSA | F246: NSA | G246: NSA | H246: =RANDBETWEEN(16161616,61616161) -> 54767024 | I246: =RC[-1]+873421 -> 55640445
A247: CASASBAHIASA | B247: 14 | C247: 47049104 | D247: NSA | E247: NSA | F247: NSA | G247: NSA | H247: =RANDBETWEEN(16161616,61616161) -> 56375118 | I247: =RC[-1]+873421 -> 57248539
A248: CASASBAHIASA | B248: 14 | C248: 65902207 | D248: NSA | E248: NSA | F248: NSA | G248: NSA | H248: =RANDBETWEEN(16161616,61616161) -> 49875993 | I248: =RC[-1]+873421 -> 50749414
A249: CASASBAHIASA | B249: 14 | C249: 75311473 | D249: NSA | E249: NSA | F249: NSA | G249: NSA | H249: =RANDBETWEEN(16161616,61616161) -> 53315787 | I249: =RC[-1]+873421 -> 54189208
A250: CASASBAHIASA | B250: 14 | C250: 58005527 | D250: NSA | E250: NSA | F250: NSA | G250: NSA | H250: =RANDBETWEEN(16161616,61616161) -> 38463888 | I250: =RC[-1]+873421 -> 39337309
A251: CASASBAHIASA | B251: 14 | C251: 45760250 | D251: NSA | E251: NSA | F251: NSA | G251: NSA | H251: =RANDBETWEEN(16161616,61616161) -> 25271705 | I251: =RC[-1]+873421 -> 26145126
A252: CASASBAHIASA | B252: 14 | C252: 61366451 | D252: NSA | E252: NSA | F252: NSA | G252: NSA | H252: =RANDBETWEEN(16161616,61616161) -> 26672188 | I252: =RC[-1]+873421 -> 27545609
A253: CASASBAHIASA | B253: 14 | C253: 73170342 | D253: NSA | E253: NSA | F253: NSA | G253: NSA | H253: =RANDBETWEEN(16161616,61616161) -> 19300703 | I253: =RC[-1]+873421 -> 20174124
A254: CASASBAHIASA | B254: 14 | C254: 36760531 | D254: NSA | E254: NSA | F254: NSA | G254: NSA | H254: =RANDBETWEEN(16161616,61616161) -> 28271421 | I254: =RC[-1]+873421 -> 29144842
A255: CASASBAHIASA | B255: 14 | C255: 26038752 | D255: NSA | E255: NSA | F255: NSA | G255: NSA | H255: =RANDBETWEEN(16161616,61616161) -> 40993883 | I255: =RC[-1]+873421 -> 41867304
A256: CASASBAHIASA | B256: 14 | C256: 51622878 | D256: NSA | E256: NSA | F256: NSA | G256: NSA | H256: =RANDBETWEEN(16161616,61616161) -> 29339621 | I256: =RC[-1]+873421 -> 30213042
A257: CASASBAHIASA | B257: 14 | C257: 78293123 | D257: NSA | E257: NSA | F257: NSA | G257: NSA | H257: =RANDBETWEEN(16161616,61616161) -> 57451803 | I257: =RC[-1]+873421 -> 58325224
A258: CASASBAHIASA | B258: 14 | C258: 68978452 | D258: NSA | E258: NSA | F258: NSA | G258: NSA | H258: =RANDBETWEEN(16161616,61616161) -> 19535071 | I258: =RC[-1]+873421 -> 20408492
A259: CASASBAHIASA | B259: 14 | C259: 45373197 | D259: NSA | E259: NSA | F259: NSA | G259: NSA | H259: =RANDBETWEEN(16161616,61616161) -> 37685247 | I259: =RC[-1]+873421 -> 38558668
A260: CASASBAHIASA | B260: 14 | C260: 44279453 | D260: NSA | E260: NSA | F260: NSA | G260: NSA | H260: =RANDBETWEEN(16161616,61616161) -> 48589454 | I260: =RC[-1]+873421 -> 49462875
A261: CASASBAHIASA | B261: 14 | C261: 43188615 | D261: NSA | E261: NSA | F261: NSA | G261: NSA | H261: =RANDBETWEEN(16161616,61616161) -> 47724527 | I261: =RC[-1]+873421 -> 48597948
A262: CASASBAHIASA | B262: 14 | C262: 46741096 | D262: NSA | E262: NSA | F262: NSA | G262: NSA | H262: =RANDBETWEEN(16161616,61616161) -> 24283277 | I262: =RC[-1]+873421 -> 25156698
A263: CASASBAHIASA | B263: 14 | C263: 30601449 | D263: NSA | E263: NSA | F263: NSA | G263: NSA | H263: =RANDBETWEEN(16161616,61616161) -> 60575591 | I263: =RC[-1]+873421 -> 61449012
A264: CASASBAHIASA | B264: 14 | C264: 48824388 | D264: NSA | E264: NSA | F264: NSA | G264: NSA | H264: =RANDBETWEEN(16161616,61616161) -> 29472085 | I264: =RC[-1]+873421 -> 30345506
A265: CASASBAHIASA | B265: 14 | C265: 20440459 | D265: NSA | E265: NSA | F265: NSA | G265: NSA | H265: =RANDBETWEEN(16161616,61616161) -> 50313620 | I265: =RC[-1]+873421 -> 51187041
A266: CASASBAHIASA | B266: 14 | C266: 71134969 | D266: NSA | E266: NSA | F266: NSA | G266: NSA | H266: =RANDBETWEEN(16161616,61616161) -> 38406653 | I266: =RC[-1]+873421 -> 39280074
A267: CASASBAHIASA | B267: 14 | C267: 62251931 | D267: NSA | E267: NSA | F267: NSA | G267: NSA | H267: =RANDBETWEEN(16161616,61616161) -> 20892575 | I267: =RC[-1]+873421 -> 21765996
A268: CASASBAHIASA | B268: 14 | C268: 48562997 | D268: NSA | E268: NSA | F268: NSA | G268: NSA | H268: =RANDBETWEEN(16161616,61616161) -> 28868893 | I268: =RC[-1]+873421 -> 29742314
A269: CASASBAHIASA | B269: 14 | C269: 72678715 | D269: NSA | E269: NSA | F269: NSA | G269: NSA | H269: =RANDBETWEEN(16161616,61616161) -> 38622118 | I269: =RC[-1]+873421 -> 39495539
A270: CASASBAHIASA | B270: 14 | C270: 45946593 | D270: NSA | E270: NSA | F270: NSA | G270: NSA | H270: =RANDBETWEEN(16161616,61616161) -> 34559813 | I270: =RC[-1]+873421 -> 35433234
A271: CASASBAHIASA | B271: 14 | C271: 40153595 | D271: NSA | E271: NSA | F271: NSA | G271: NSA | H271: =RANDBETWEEN(16161616,61616161) -> 47256807 | I271: =RC[-1]+873421 -> 48130228
A272: CASASBAHIASA | B272: 14 | C272: 41137244 | D272: NSA | E272: NSA | F272: NSA | G272: NSA | H272: =RANDBETWEEN(16161616,61616161) -> 45309337 | I272: =RC[-1]+873421 -> 46182758
A273: CASASBAHIASA | B273: 14 | C273: 28523713 | D273: NSA | E273: NSA | F273: NSA | G273: NSA | H273: =RANDBETWEEN(16161616,61616161) -> 21499203 | I273: =RC[-1]+873421 -> 22372624
A274: CASASBAHIASA | B274: 14 | C274: 78781349 | D274: NSA | E274: NSA | F274: NSA | G274: NSA | H274: =RANDBETWEEN(16161616,61616161) -> 35680823 | I274: =RC[-1]+873421 -> 36554244
A275: CASASBAHIASA | B275: 14 | C275: 79631769 | D275: NSA | E275: NSA | F275: NSA | G275: NSA | H275: =RANDBETWEEN(16161616,61616161) -> 50231083 | I275: =RC[-1]+873421 -> 51104504
A276: CASASBAHIASA | B276: 14 | C276: 44340455 | D276: NSA | E276: NSA | F276: NSA | G276: NSA | H276: =RANDBETWEEN(16161616,61616161) -> 59746756 | I276: =RC[-1]+873421 -> 60620177
A277: CASASBAHIASA | B277: 14 | C277: 32635713 | D277: NSA | E277: NSA | F277: NSA | G277: NSA | H277: =RANDBETWEEN(16161616,61616161) -> 27226453 | I277: =RC[-1]+873421 -> 28099874
A278: CASASBAHIASA | B278: 14 | C278: 39626719 | D278: NSA | E278: NSA | F278: NSA | G278: NSA | H278: =RANDBETWEEN(16161616,61616161) -> 26155483 | I278: =RC[-1]+873421 -> 27028904
A279: CASASBAHIASA | B279: 14 | C279: 25111842 | D279: NSA | E279: NSA | F279: NSA | G279: NSA | H279: =RANDBETWEEN(16161616,61616161) -> 50146209 | I279: =RC[-1]+873421 -> 51019630
A280: CASASBAHIASA | B280: 14 | C280: 58550523 | D280: NSA | E280: NSA | F280: NSA | G280: NSA | H280: =RANDBETWEEN(16161616,61616161) -> 37686529 | I280: =RC[-1]+873421 -> 38559950
A281: CASASBAHIASA | B281: 14 | C281: 77925326 | D281: NSA | E281: NSA | F281: NSA | G281: NSA | H281: =RANDBETWEEN(16161616,61616161) -> 46957726 | I281: =RC[-1]+873421 -> 47831147
A282: CASASBAHIASA | B282: 14 | C282: 37956763 | D282: NSA | E282: NSA | F282: NSA | G282: NSA | H282: =RANDBETWEEN(16161616,61616161) -> 30246346 | I282: =RC[-1]+873421 -> 31119767
A283: CASASBAHIASA | B283: 14 | C283: 53664255 | D283: NSA | E283: NSA | F283: NSA | G283: NSA | H283: =RANDBETWEEN(16161616,61616161) -> 16822872 | I283: =RC[-1]+873421 -> 17696293
A284: CASASBAHIASA | B284: 14 | C284: 68776547 | D284: NSA | E284: NSA | F284: NSA | G284: NSA | H284: =RANDBETWEEN(16161616,61616161) -> 61428282 | I284: =RC[-1]+873421 -> 62301703
A285: CASASBAHIASA | B285: 14 | C285: 52990920 | D285: NSA | E285: NSA | F285: NSA | G285: NSA | H285: =RANDBETWEEN(16161616,61616161) -> 36032542 | I285: =RC[-1]+873421 -> 36905963
A286: CASASBAHIASA | B286: 14 | C286: 48470749 | D286: NSA | E286: NSA | F286: NSA | G286: NSA | H286: =RANDBETWEEN(16161616,61616161) -> 55830946 | I286: =RC[-1]+873421 -> 56704367
A287: CASASBAHIASA | B287: 14 | C287: 32491619 | D287: NSA | E287: NSA | F287: NSA | G287: NSA | H287: =RANDBETWEEN(16161616,61616161) -> 61274872 | I287: =RC[-1]+873421 -> 62148293
A288: CASASBAHIASA | B288: 14 | C288: 21045502 | D288: NSA | E288: NSA | F288: NSA | G288: NSA | H288: =RANDBETWEEN(16161616,61616161) -> 35096691 | I288: =RC[-1]+873421 -> 35970112
A289: CASASBAHIASA | B289: 14 | C289: 22067272 | D289: NSA | E289: NSA | F289: NSA | G289: NSA | H289: =RANDBETWEEN(16161616,61616161) -> 44082379 | I289: =RC[-1]+873421 -> 44955800
A290: CASASBAHIASA | B290: 14 | C290: 72434492 | D290: NSA | E290: NSA | F290: NSA | G290: NSA | H290: =RANDBETWEEN(16161616,61616161) -> 43015560 | I290: =RC[-1]+873421 -> 43888981
A291: CASASBAHIASA | B291: 14 | C291: 61664107 | D291: NSA | E291: NSA | F291: NSA | G291: NSA | H291: =RANDBETWEEN(16161616,61616161) -> 39295834 | I291: =RC[-1]+873421 -> 40169255
A292: CASASBAHIASA | B292: 14 | C292: 32499818 | D292: NSA | E292: NSA | F292: NSA | G292: NSA | H292: =RANDBETWEEN(16161616,61616161) -> 43711064 | I292: =RC[-1]+873421 -> 44584485
A293: CASASBAHIASA | B293: 14 | C293: 49891253 | D293: NSA | E293: NSA | F293: NSA | G293: NSA | H293: =RANDBETWEEN(16161616,61616161) -> 42172998 | I293: =RC[-1]+873421 -> 43046419
A294: CASASBAHIASA | B294: 14 | C294: 36799340 | D294: NSA | E294: NSA | F294: NSA | G294: NSA | H294: =RANDBETWEEN(16161616,61616161) -> 20766992 | I294: =RC[-1]+873421 -> 21640413
A295: CASASBAHIASA | B295: 14 | C295: 78756310 | D295: NSA | E295: NSA | F295: NSA | G295: NSA | H295: =RANDBETWEEN(16161616,61616161) -> 60447538 | I295: =RC[-1]+873421 -> 61320959
A296: CASASBAHIASA | B296: 14 | C296: 39716225 | D296: NSA | E296: NSA | F296: NSA | G296: NSA | H296: =RANDBETWEEN(16161616,61616161) -> 42704389 | I296: =RC[-1]+873421 -> 43577810
A297: CASASBAHIASA | B297: 14 | C297: 24216225 | D297: NSA | E297: NSA | F297: NSA | G297: NSA | H297: =RANDBETWEEN(16161616,61616161) -> 37718131 | I297: =RC[-1]+873421 -> 38591552
A298: CASASBAHIASA | B298: 14 | C298: 57684449 | D298: NSA | E298: NSA | F298: NSA | G298: NSA | H298: =RANDBETWEEN(16161616,61616161) -> 54590346 | I298: =RC[-1]+873421 -> 55463767
A299: CASASBAHIASA | B299: 14 | C299: 64838938 | D299: NSA | E299: NSA | F299: NSA | G299: NSA | H299: =RANDBETWEEN(16161616,61616161) -> 22871495 | I299: =RC[-1]+873421 -> 23744916
A300: CASASBAHIASA | B300: 14 | C300: 64215309 | D300: NSA | E300: NSA | F300: NSA | G300: NSA | H300: =RANDBETWEEN(16161616,61616161) -> 24805248 | I300: =RC[-1]+873421 -> 25678669
A301: CASASBAHIASA | B301: 14 | C301: 20481480 | D301: NSA | E301: NSA | F301: NSA | G301: NSA | H301: =RANDBETWEEN(16161616,61616161) -> 40854260 | I301: =RC[-1]+873421 -> 41727681
A302: CASASBAHIASA | B302: 14 | C302: 68701031 | D302: NSA | E302: NSA | F302: NSA | G302: NSA | H302: =RANDBETWEEN(16161616,61616161) -> 54743705 | I302: =RC[-1]+873421 -> 55617126
A303: CASASBAHIASA | B303: 14 | C303: 62269864 | D303: NSA | E303: NSA | F303: NSA | G303: NSA | H303: =RANDBETWEEN(16161616,61616161) -> 35115401 | I303: =RC[-1]+873421 -> 35988822
A304: CASASBAHIASA | B304: 14 | C304: 74047692 | D304: NSA | E304: NSA | F304: NSA | G304: NSA | H304: =RANDBETWEEN(16161616,61616161) -> 35191561 | I304: =RC[-1]+873421 -> 36064982
A305: CASASBAHIASA | B305: 14 | C305: 58582364 | D305: NSA | E305: NSA | F305: NSA | G305: NSA | H305: =RANDBETWEEN(16161616,61616161) -> 38623046 | I305: =RC[-1]+873421 -> 39496467
A306: CASASBAHIASA | B306: 14 | C306: 50818951 | D306: NSA | E306: NSA | F306: NSA | G306: NSA | H306: =RANDBETWEEN(16161616,61616161) -> 24573139 | I306: =RC[-1]+873421 -> 25446560
A307: CASASBAHIASA | B307: 14 | C307: 34697239 | D307: NSA | E307: NSA | F307: NSA | G307: NSA | H307: =RANDBETWEEN(16161616,61616161) -> 38431678 | I307: =RC[-1]+873421 -> 39305099
A308: CASASBAHIASA | B308: 14 | C308: 47808589 | D308: NSA | E308: NSA | F308: NSA | G308: NSA | H308: =RANDBETWEEN(16161616,61616161) -> 51786093 | I308: =RC[-1]+873421 -> 52659514
A309: CASASBAHIASA | B309: 14 | C309: 20011279 | D309: NSA | E309: NSA | F309: NSA | G309: NSA | H309: =RANDBETWEEN(16161616,61616161) -> 35833339 | I309: =RC[-1]+873421 -> 36706760
A310: CASASBAHIASA | B310: 14 | C310: 47601798 | D310: NSA | E310: NSA | F310: NSA | G310: NSA | H310: =RANDBETWEEN(16161616,61616161) -> 39340562 | I310: =RC[-1]+873421 -> 40213983
A311: CASASBAHIASA | B311: 14 | C311: 59093413 | D311: NSA | E311: NSA | F311: NSA | G311: NSA | H311: =RANDBETWEEN(16161616,61616161) -> 39116396 | I311: =RC[-1]+873421 -> 39989817
A312: CASASBAHIASA | B312: 14 | C312: 47751305 | D312: NSA | E312: NSA | F312: NSA | G312: NSA | H312: =RANDBETWEEN(16161616,61616161) -> 51640334 | I312: =RC[-1]+873421 -> 52513755
A313: CASASBAHIASA | B313: 14 | C313: 30231649 | D313: NSA | E313: NSA | F313: NSA | G313: NSA | H313: =RANDBETWEEN(16161616,61616161) -> 16623413 | I313: =RC[-1]+873421 -> 17496834
A314: CASASBAHIASA | B314: 14 | C314: 54780092 | D314: NSA | E314: NSA | F314: NSA | G314: NSA | H314: =RANDBETWEEN(16161616,61616161) -> 42119298 | I314: =RC[-1]+873421 -> 42992719
A315: CASASBAHIASA | B315: 14 | C315: 53957038 | D315: NSA | E315: NSA | F315: NSA | G315: NSA | H315: =RANDBETWEEN(16161616,61616161) -> 33903431 | I315: =RC[-1]+873421 -> 34776852
A316: CASASBAHIASA | B316: 14 | C316: 76412583 | D316: NSA | E316: NSA | F316: NSA | G316: NSA | H316: =RANDBETWEEN(16161616,61616161) -> 40369349 | I316: =RC[-1]+873421 -> 41242770
A317: CASASBAHIASA | B317: 14 | C317: 46052645 | D317: NSA | E317: NSA | F317: NSA | G317: NSA | H317: =RANDBETWEEN(16161616,61616161) -> 46842659 | I317: =RC[-1]+873421 -> 47716080
A318: CASASBAHIASA | B318: 14 | C318: 27819352 | D318: NSA | E318: NSA | F318: NSA | G318: NSA | H318: =RANDBETWEEN(16161616,61616161) -> 17293529 | I318: =RC[-1]+873421 -> 18166950
A319: CASASBAHIASA | B319: 14 | C319: 43294961 | D319: NSA | E319: NSA | F319: NSA | G319: NSA | H319: =RANDBETWEEN(16161616,61616161) -> 31131364 | I319: =RC[-1]+873421 -> 32004785
A320: CASASBAHIASA | B320: 14 | C320: 41758152 | D320: NSA | E320: NSA | F320: NSA | G320: NSA | H320: =RANDBETWEEN(16161616,61616161) -> 48446010 | I320: =RC[-1]+873421 -> 49319431
A321: CASASBAHIASA | B321: 14 | C321: 19693415 | D321: NSA | E321: NSA | F321: NSA | G321: NSA | H321: =RANDBETWEEN(16161616,61616161) -> 55784314 | I321: =RC[-1]+873421 -> 56657735
A322: CASASBAHIASA | B322: 14 | C322: 33404716 | D322: NSA | E322: NSA | F322: NSA | G322: NSA | H322: =RANDBETWEEN(16161616,61616161) -> 49853780 | I322: =RC[-1]+873421 -> 50727201
A323: CASASBAHIASA | B323: 14 | C323: 66226985 | D323: NSA | E323: NSA | F323: NSA | G323: NSA | H323: =RANDBETWEEN(16161616,61616161) -> 44148857 | I323: =RC[-1]+873421 -> 45022278
A324: CASASBAHIASA | B324: 14 | C324: 60177264 | D324: NSA | E324: NSA | F324: NSA | G324: NSA | H324: =RANDBETWEEN(16161616,61616161) -> 19041456 | I324: =RC[-1]+873421 -> 19914877
A325: CASASBAHIASA | B325: 14 | C325: 55134896 | D325: NSA | E325: NSA | F325: NSA | G325: NSA | H325: =RANDBETWEEN(16161616,61616161) -> 27869203 | I325: =RC[-1]+873421 -> 28742624
A326: CASASBAHIASA | B326: 14 | C326: 79623781 | D326: NSA | E326: NSA | F326: NSA | G326: NSA | H326: =RANDBETWEEN(16161616,61616161) -> 46079647 | I326: =RC[-1]+873421 -> 46953068
A327: CASASBAHIASA | B327: 14 | C327: 20503411 | D327: NSA | E327: NSA | F327: NSA | G327: NSA | H327: =RANDBETWEEN(16161616,61616161) -> 35080737 | I327: =RC[-1]+873421 -> 35954158
A328: CASASBAHIASA | B328: 14 | C328: 33148291 | D328: NSA | E328: NSA | F328: NSA | G328: NSA | H328: =RANDBETWEEN(16161616,61616161) -> 55982570 | I328: =RC[-1]+873421 -> 56855991
A329: CASASBAHIASA | B329: 14 | C329: 40628319 | D329: NSA | E329: NSA | F329: NSA | G329: NSA | H329: =RANDBETWEEN(16161616,61616161) -> 45096453 | I329: =RC[-1]+873421 -> 45969874
A330: CASASBAHIASA | B330: 14 | C330: 18220085 | D330: NSA | E330: NSA | F330: NSA | G330: NSA | H330: =RANDBETWEEN(16161616,61616161) -> 40160969 | I330: =RC[-1]+873421 -> 41034390
A331: CASASBAHIASA | B331: 14 | C331: 78015396 | D331: NSA | E331: NSA | F331: NSA | G331: NSA | H331: =RANDBETWEEN(16161616,61616161) -> 33473475 | I331: =RC[-1]+873421 -> 34346896
A332: CASASBAHIASA | B332: 14 | C332: 70667703 | D332: NSA | E332: NSA | F332: NSA | G332: NSA | H332: =RANDBETWEEN(16161616,61616161) -> 17399485 | I332: =RC[-1]+873421 -> 18272906
A333: CASASBAHIASA | B333: 14 | C333: 60491829 | D333: NSA | E333: NSA | F333: NSA | G333: NSA | H333: =RANDBETWEEN(16161616,61616161) -> 22660805 | I333: =RC[-1]+873421 -> 23534226
A334: CASASBAHIASA | B334: 14 | C334: 59344206 | D334: NSA | E334: NSA | F334: NSA | G334: NSA | H334: =RANDBETWEEN(16161616,61616161) -> 52123290 | I334: =RC[-1]+873421 -> 52996711
A335: CASASBAHIASA | B335: 14 | C335: 35684694 | D335: NSA | E335: NSA | F335: NSA | G335: NSA | H335: =RANDBETWEEN(16161616,61616161) -> 58607692 | I335: =RC[-1]+873421 -> 59481113
A336: CASASBAHIASA | B336: 14 | C336: 76009369 | D336: NSA | E336: NSA | F336: NSA | G336: NSA | H336: =RANDBETWEEN(16161616,61616161) -> 40656801 | I336: =RC[-1]+873421 -> 41530222
A337: CASASBAHIASA | B337: 14 | C337: 23398040 | D337: NSA | E337: NSA | F337: NSA | G337: NSA | H337: =RANDBETWEEN(16161616,61616161) -> 30955687 | I337: =RC[-1]+873421 -> 31829108
A338: CASASBAHIASA | B338: 14 | C338: 39059646 | D338: NSA | E338: NSA | F338: NSA | G338: NSA | H338: =RANDBETWEEN(16161616,61616161) -> 59467707 | I338: =RC[-1]+873421 -> 60341128
A339: CASASBAHIASA | B339: 14 | C339: 74317305 | D339: NSA | E339: NSA | F339: NSA | G339: NSA | H339: =RANDBETWEEN(16161616,61616161) -> 51597899 | I339: =RC[-1]+873421 -> 52471320
A340: CASASBAHIASA | B340: 14 | C340: 26060537 | D340: NSA | E340: NSA | F340: NSA | G340: NSA | H340: =RANDBETWEEN(16161616,61616161) -> 25766456 | I340: =RC[-1]+873421 -> 26639877
A341: CASASBAHIASA | B341: 14 | C341: 58101490 | D341: NSA | E341: NSA | F341: NSA | G341: NSA | H341: =RANDBETWEEN(16161616,61616161) -> 49518339 | I341: =RC[-1]+873421 -> 50391760
A342: CASASBAHIASA | B342: 14 | C342: 69511131 | D342: NSA | E342: NSA | F342: NSA | G342: NSA | H342: =RANDBETWEEN(16161616,61616161) -> 57443480 | I342: =RC[-1]+873421 -> 58316901
A343: CASASBAHIASA | B343: 14 | C343: 62181157 | D343: NSA | E343: NSA | F343: NSA | G343: NSA | H343: =RANDBETWEEN(16161616,61616161) -> 20367485 | I343: =RC[-1]+873421 -> 21240906
A344: CASASBAHIASA | B344: 14 | C344: 27723334 | D344: NSA | E344: NSA | F344: NSA | G344: NSA | H344: =RANDBETWEEN(16161616,61616161) -> 28502632 | I344: =RC[-1]+873421 -> 29376053
A345: CASASBAHIASA | B345: 14 | C345: 52537056 | D345: NSA | E345: NSA | F345: NSA | G345: NSA | H345: =RANDBETWEEN(16161616,61616161) -> 39148970 | I345: =RC[-1]+873421 -> 40022391
A346: CASASBAHIASA | B346: 14 | C346: 72659013 | D346: NSA | E346: NSA | F346: NSA | G346: NSA | H346: =RANDBETWEEN(16161616,61616161) -> 26245053 | I346: =RC[-1]+873421 -> 27118474
A347: CASASBAHIASA | B347: 14 | C347: 38514004 | D347: NSA | E347: NSA | F347: NSA | G347: NSA | H347: =RANDBETWEEN(16161616,61616161) -> 19110592 | I347: =RC[-1]+873421 -> 19984013
A348: CASASBAHIASA | B348: 14 | C348: 45045195 | D348: NSA | E348: NSA | F348: NSA | G348: NSA | H348: =RANDBETWEEN(16161616,61616161) -> 31271340 | I348: =RC[-1]+873421 -> 32144761
A349: CASASBAHIASA | B349: 14 | C349: 53201092 | D349: NSA | E349: NSA | F349: NSA | G349: NSA | H349: =RANDBETWEEN(16161616,61616161) -> 24971444 | I349: =RC[-1]+873421 -> 25844865
A350: CASASBAHIASA | B350: 14 | C350: 42131575 | D350: NSA | E350: NSA | F350: NSA | G350: NSA | H350: =RANDBETWEEN(16161616,61616161) -> 21033412 | I350: =RC[-1]+873421 -> 21906833
A351: CASASBAHIASA | B351: 14 | C351: 71191388 | D351: NSA | E351: NSA | F351: NSA | G351: NSA | H351: =RANDBETWEEN(16161616,61616161) -> 56027759 | I351: =RC[-1]+873421 -> 56901180
A352: CASASBAHIASA | B352: 14 | C352: 31607903 | D352: NSA | E352: NSA | F352: NSA | G352: NSA | H352: =RANDBETWEEN(16161616,61616161) -> 35419559 | I352: =RC[-1]+873421 -> 36292980
A353: CASASBAHIASA | B353: 14 | C353: 63747064 | D353: NSA | E353: NSA | F353: NSA | G353: NSA | H353: =RANDBETWEEN(16161616,61616161) -> 51399898 | I353: =RC[-1]+873421 -> 52273319
A354: CASASBAHIASA | B354: 14 | C354: 49778950 | D354: NSA | E354: NSA | F354: NSA | G354: NSA | H354: =RANDBETWEEN(16161616,61616161) -> 16288111 | I354: =RC[-1]+873421 -> 17161532
A355: CASASBAHIASA | B355: 14 | C355: 60212623 | D355: NSA | E355: NSA | F355: NSA | G355: NSA | H355: =RANDBETWEEN(16161616,61616161) -> 35257358 | I355: =RC[-1]+873421 -> 36130779
A356: CASASBAHIASA | B356: 14 | C356: 78679327 | D356: NSA | E356: NSA | F356: NSA | G356: NSA | H356: =RANDBETWEEN(16161616,61616161) -> 34998509 | I356: =RC[-1]+873421 -> 35871930
A357: CASASBAHIASA | B357: 14 | C357: 33590071 | D357: NSA | E357: NSA | F357: NSA | G357: NSA | H357: =RANDBETWEEN(16161616,61616161) -> 28497348 | I357: =RC[-1]+873421 -> 29370769
A358: CASASBAHIASA | B358: 14 | C358: 67013082 | D358: NSA | E358: NSA | F358: NSA | G358: NSA | H358: =RANDBETWEEN(16161616,61616161) -> 39475257 | I358: =RC[-1]+873421 -> 40348678
A359: CASASBAHIASA | B359: 14 | C359: 60511716 | D359: NSA | E359: NSA | F359: NSA | G359: NSA | H359: =RANDBETWEEN(16161616,61616161) -> 49418658 | I359: =RC[-1]+873421 -> 50292079
A360: CASASBAHIASA | B360: 14 | C360: 48196723 | D360: NSA | E360: NSA | F360: NSA | G360: NSA | H360: =RANDBETWEEN(16161616,61616161) -> 43192181 | I360: =RC[-1]+873421 -> 44065602
A361: CASASBAHIASA | B361: 14 | C361: 74690690 | D361: NSA | E361: NSA | F361: NSA | G361: NSA | H361: =RANDBETWEEN(16161616,61616161) -> 54986517 | I361: =RC[-1]+873421 -> 55859938
A362: CASASBAHIASA | B362: 14 | C362: 62256140 | D362: NSA | E362: NSA | F362: NSA | G362: NSA | H362: =RANDBETWEEN(16161616,61616161) -> 55539700 | I362: =RC[-1]+873421 -> 56413121
A363: CASASBAHIASA | B363: 14 | C363: 20505768 | D363: NSA | E363: NSA | F363: NSA | G363: NSA | H363: =RANDBETWEEN(16161616,61616161) -> 45920992 | I363: =RC[-1]+873421 -> 46794413
A364: CASASBAHIASA | B364: 14 | C364: 42345695 | D364: NSA | E364: NSA | F364: NSA | G364: NSA | H364: =RANDBETWEEN(16161616,61616161) -> 41294887 | I364: =RC[-1]+873421 -> 42168308
A365: CASASBAHIASA | B365: 14 | C365: 46727682 | D365: NSA | E365: NSA | F365: NSA | G365: NSA | H365: =RANDBETWEEN(16161616,61616161) -> 32786919 | I365: =RC[-1]+873421 -> 33660340
A366: CASASBAHIASA | B366: 14 | C366: 39681517 | D366: NSA | E366: NSA | F366: NSA | G366: NSA | H366: =RANDBETWEEN(16161616,61616161) -> 39389710 | I366: =RC[-1]+873421 -> 40263131
A367: CASASBAHIASA | B367: 14 | C367: 77278557 | D367: NSA | E367: NSA | F367: NSA | G367: NSA | H367: =RANDBETWEEN(16161616,61616161) -> 30094226 | I367: =RC[-1]+873421 -> 30967647
A368: CASASBAHIASA | B368: 14 | C368: 34106189 | D368: NSA | E368: NSA | F368: NSA | G368: NSA | H368: =RANDBETWEEN(16161616,61616161) -> 18229526 | I368: =RC[-1]+873421 -> 19102947
A369: CASASBAHIASA | B369: 14 | C369: 44242477 | D369: NSA | E369: NSA | F369: NSA | G369: NSA | H369: =RANDBETWEEN(16161616,61616161) -> 46119345 | I369: =RC[-1]+873421 -> 46992766
A370: CASASBAHIASA | B370: 14 | C370: 39504701 | D370: NSA | E370: NSA | F370: NSA | G370: NSA | H370: =RANDBETWEEN(16161616,61616161) -> 46212881 | I370: =RC[-1]+873421 -> 47086302
A371: CASASBAHIASA | B371: 14 | C371: 73514524 | D371: NSA | E371: NSA | F371: NSA | G371: NSA | H371: =RANDBETWEEN(16161616,61616161) -> 34398561 | I371: =RC[-1]+873421 -> 35271982
A372: CASASBAHIASA | B372: 14 | C372: 66297863 | D372: NSA | E372: NSA | F372: NSA | G372: NSA | H372: =RANDBETWEEN(16161616,61616161) -> 54457272 | I372: =RC[-1]+873421 -> 55330693
A373: CASASBAHIASA | B373: 14 | C373: 22725253 | D373: NSA | E373: NSA | F373: NSA | G373: NSA | H373: =RANDBETWEEN(16161616,61616161) -> 51102272 | I373: =RC[-1]+873421 -> 51975693
A374: CASASBAHIASA | B374: 14 | C374: 57474162 | D374: NSA | E374: NSA | F374: NSA | G374: NSA | H374: =RANDBETWEEN(16161616,61616161) -> 38494276 | I374: =RC[-1]+873421 -> 39367697
A375: CASASBAHIASA | B375: 14 | C375: 30139900 | D375: NSA | E375: NSA | F375: NSA | G375: NSA | H375: =RANDBETWEEN(16161616,61616161) -> 24643747 | I375: =RC[-1]+873421 -> 25517168
A376: CASASBAHIASA | B376: 14 | C376: 59522215 | D376: NSA | E376: NSA | F376: NSA | G376: NSA | H376: =RANDBETWEEN(16161616,61616161) -> 48323831 | I376: =RC[-1]+873421 -> 49197252
A377: CASASBAHIASA | B377: 14 | C377: 19670216 | D377: NSA | E377: NSA | F377: NSA | G377: NSA | H377: =RANDBETWEEN(16161616,61616161) -> 32817215 | I377: =RC[-1]+873421 -> 33690636
A378: CASASBAHIASA | B378: 14 | C378: 30937617 | D378: NSA | E378: NSA | F378: NSA | G378: NSA | H378: =RANDBETWEEN(16161616,61616161) -> 42835563 | I378: =RC[-1]+873421 -> 43708984
A379: CASASBAHIASA | B379: 14 | C379: 49194730 | D379: NSA | E379: NSA | F379: NSA | G379: NSA | H379: =RANDBETWEEN(16161616,61616161) -> 36693967 | I379: =RC[-1]+873421 -> 37567388
A380: CASASBAHIASA | B380: 14 | C380: 69622896 | D380: NSA | E380: NSA | F380: NSA | G380: NSA | H380: =RANDBETWEEN(16161616,61616161) -> 46368505 | I380: =RC[-1]+873421 -> 47241926
A381: CASASBAHIASA | B381: 14 | C381: 48434218 | D381: NSA | E381: NSA | F381: NSA | G381: NSA | H381: =RANDBETWEEN(16161616,61616161) -> 24807591 | I381: =RC[-1]+873421 -> 25681012
A382: CASASBAHIASA | B382: 14 | C382: 33069612 | D382: NSA | E382: NSA | F382: NSA | G382: NSA | H382: =RANDBETWEEN(16161616,61616161) -> 29835971 | I382: =RC[-1]+873421 -> 30709392
A383: CASASBAHIASA | B383: 14 | C383: 25409371 | D383: NSA | E383: NSA | F383: NSA | G383: NSA | H383: =RANDBETWEEN(16161616,61616161) -> 59815175 | I383: =RC[-1]+873421 -> 60688596
A384: CASASBAHIASA | B384: 14 | C384: 44799492 | D384: NSA | E384: NSA | F384: NSA | G384: NSA | H384: =RANDBETWEEN(16161616,61616161) -> 58491767 | I384: =RC[-1]+873421 -> 59365188
A385: CASASBAHIASA | B385: 14 | C385: 54242679 | D385: NSA | E385: NSA | F385: NSA | G385: NSA | H385: =RANDBETWEEN(16161616,61616161) -> 32185147 | I385: =RC[-1]+873421 -> 33058568
A386: CASASBAHIASA | B386: 14 | C386: 75482555 | D386: NSA | E386: NSA | F386: NSA | G386: NSA | H386: =RANDBETWEEN(16161616,61616161) -> 60931625 | I386: =RC[-1]+873421 -> 61805046
A387: CASASBAHIASA | B387: 14 | C387: 26151321 | D387: NSA | E387: NSA | F387: NSA | G387: NSA | H387: =RANDBETWEEN(16161616,61616161) -> 52026310 | I387: =RC[-1]+873421 -> 52899731
A388: CASASBAHIASA | B388: 14 | C388: 25138654 | D388: NSA | E388: NSA | F388: NSA | G388: NSA | H388: =RANDBETWEEN(16161616,61616161) -> 45313823 | I388: =RC[-1]+873421 -> 46187244
A389: CASASBAHIASA | B389: 14 | C389: 29508972 | D389: NSA | E389: NSA | F389: NSA | G389: NSA | H389: =RANDBETWEEN(16161616,61616161) -> 49367080 | I389: =RC[-1]+873421 -> 50240501
A390: CASASBAHIASA | B390: 14 | C390: 22230142 | D390: NSA | E390: NSA | F390: NSA | G390: NSA | H390: =RANDBETWEEN(16161616,61616161) -> 22280934 | I390: =RC[-1]+873421 -> 23154355
A391: CASASBAHIASA | B391: 14 | C391: 52628187 | D391: NSA | E391: NSA | F391: NSA | G391: NSA | H391: =RANDBETWEEN(16161616,61616161) -> 40981410 | I391: =RC[-1]+873421 -> 41854831
A392: CASASBAHIASA | B392: 14 | C392: 59473527 | D392: NSA | E392: NSA | F392: NSA | G392: NSA | H392: =RANDBETWEEN(16161616,61616161) -> 52809341 | I392: =RC[-1]+873421 -> 53682762
A393: CASASBAHIASA | B393: 14 | C393: 59210087 | D393: NSA | E393: NSA | F393: NSA | G393: NSA | H393: =RANDBETWEEN(16161616,61616161) -> 22788962 | I393: =RC[-1]+873421 -> 23662383
A394: CASASBAHIASA | B394: 14 | C394: 20335447 | D394: NSA | E394: NSA | F394: NSA | G394: NSA | H394: =RANDBETWEEN(16161616,61616161) -> 59034028 | I394: =RC[-1]+873421 -> 59907449
A395: CASASBAHIASA | B395: 14 | C395: 76110923 | D395: NSA | E395: NSA | F395: NSA | G395: NSA | H395: =RANDBETWEEN(16161616,61616161) -> 46309777 | I395: =RC[-1]+873421 -> 47183198
A396: CASASBAHIASA | B396: 14 | C396: 52486905 | D396: NSA | E396: NSA | F396: NSA | G396: NSA | H396: =RANDBETWEEN(16161616,61616161) -> 28395783 | I396: =RC[-1]+873421 -> 29269204
A397: CASASBAHIASA | B397: 14 | C397: 18195126 | D397: NSA | E397: NSA | F397: NSA | G397: NSA | H397: =RANDBETWEEN(16161616,61616161) -> 60409167 | I397: =RC[-1]+873421 -> 61282588
A398: CASASBAHIASA | B398: 14 | C398: 25566158 | D398: NSA | E398: NSA | F398: NSA | G398: NSA | H398: =RANDBETWEEN(16161616,61616161) -> 37394692 | I398: =RC[-1]+873421 -> 38268113
A399: CASASBAHIASA | B399: 14 | C399: 27455630 | D399: NSA | E399: NSA | F399: NSA | G399: NSA | H399: =RANDBETWEEN(16161616,61616161) -> 46748561 | I399: =RC[-1]+873421 -> 47621982
A400: CASASBAHIASA | B400: 14 | C400: 49100846 | D400: NSA | E400: NSA | F400: NSA | G400: NSA | H400: =RANDBETWEEN(16161616,61616161) -> 30557990 | I400: =RC[-1]+873421 -> 31431411